"Apache CloudStack","API 4.9","https://cloudstack.provider.com:[port]/client/api?command=activateProject&amp;[parameters of this command]","POST","http://cloudstack.apache.org/api/apidocs-4.9/apis/activateProject.html","Activates a project"
"Apache CloudStack","API 4.9","https://cloudstack.provider.com:[port]/client/api?command=deleteRole&amp;[parameters of this command]","POST","http://cloudstack.apache.org/api/apidocs-4.9/apis/deleteRole.html","Deletes a role"
"Apache CloudStack","API 4.9","https://cloudstack.provider.com:[port]/client/api?command=deleteRolePermission&amp;[parameters of this command]","POST","http://cloudstack.apache.org/api/apidocs-4.9/apis/deleteRolePermission.html","Deletes a role permission"
"Apache CloudStack","API 4.9","https://cloudstack.provider.com:[port]/client/api?command=deleteSSHKeyPair&amp;[parameters of this command]","POST","http://cloudstack.apache.org/api/apidocs-4.9/apis/deleteSSHKeyPair.html","Deletes a keypair by name"
"Apache CloudStack","API 4.9","https://cloudstack.provider.com:[port]/client/api?command=deleteSecondaryStagingStore&amp;[parameters of this command]","POST","http://cloudstack.apache.org/api/apidocs-4.9/apis/deleteSecondaryStagingStore.html","Deletes a secondary staging store ."
"Apache CloudStack","API 4.9","https://cloudstack.provider.com:[port]/client/api?command=deleteSecurityGroup&amp;[parameters of this command]","POST","http://cloudstack.apache.org/api/apidocs-4.9/apis/deleteSecurityGroup.html","Deletes security group"
"Apache CloudStack","API 4.9","https://cloudstack.provider.com:[port]/client/api?command=deleteServiceOffering&amp;[parameters of this command]","POST","http://cloudstack.apache.org/api/apidocs-4.9/apis/deleteServiceOffering.html","Deletes a service offering."
"Apache CloudStack","API 4.9","https://cloudstack.provider.com:[port]/client/api?command=deleteSnapshot&amp;[parameters of this command]","POST","http://cloudstack.apache.org/api/apidocs-4.9/apis/deleteSnapshot.html","Deletes a snapshot of a disk volume."
"Apache CloudStack","API 4.9","https://cloudstack.provider.com:[port]/client/api?command=deleteSnapshotPolicies&amp;[parameters of this command]","POST","http://cloudstack.apache.org/api/apidocs-4.9/apis/deleteSnapshotPolicies.html","Deletes snapshot policies for the account."
"Apache CloudStack","API 4.9","https://cloudstack.provider.com:[port]/client/api?command=deleteSrxFirewall&amp;[parameters of this command]","POST","http://cloudstack.apache.org/api/apidocs-4.9/apis/deleteSrxFirewall.html"," delete a SRX firewall device"
"Apache CloudStack","API 4.9","https://cloudstack.provider.com:[port]/client/api?command=deleteSslCert&amp;[parameters of this command]","POST","http://cloudstack.apache.org/api/apidocs-4.9/apis/deleteSslCert.html","Delete a certificate to CloudStack"
"Apache CloudStack","API 4.9","https://cloudstack.provider.com:[port]/client/api?command=deleteStaticRoute&amp;[parameters of this command]","POST","http://cloudstack.apache.org/api/apidocs-4.9/apis/deleteStaticRoute.html","Deletes a static route"
"Apache CloudStack","API 4.9","https://cloudstack.provider.com:[port]/client/api?command=deleteStorageNetworkIpRange&amp;[parameters of this command]","POST","http://cloudstack.apache.org/api/apidocs-4.9/apis/deleteStorageNetworkIpRange.html","Deletes a storage network IP Range."
"Apache CloudStack","API 4.9","https://cloudstack.provider.com:[port]/client/api?command=deleteStoragePool&amp;[parameters of this command]","POST","http://cloudstack.apache.org/api/apidocs-4.9/apis/deleteStoragePool.html","Deletes a storage pool."
"Apache CloudStack","API 4.9","https://cloudstack.provider.com:[port]/client/api?command=deleteStratosphereSsp&amp;[parameters of this command]","POST","http://cloudstack.apache.org/api/apidocs-4.9/apis/deleteStratosphereSsp.html","Removes stratosphere ssp server"
"Apache CloudStack","API 4.9","https://cloudstack.provider.com:[port]/client/api?command=deleteTags&amp;[parameters of this command]","POST","http://cloudstack.apache.org/api/apidocs-4.9/apis/deleteTags.html","Deleting resource tag(s)"
"Apache CloudStack","API 4.9","https://cloudstack.provider.com:[port]/client/api?command=deleteTemplate&amp;[parameters of this command]","POST","http://cloudstack.apache.org/api/apidocs-4.9/apis/deleteTemplate.html","Deletes a template from the system. All virtual machines using the deleted template will not be affected."
"Apache CloudStack","API 4.9","https://cloudstack.provider.com:[port]/client/api?command=deleteTrafficMonitor&amp;[parameters of this command]","POST","http://cloudstack.apache.org/api/apidocs-4.9/apis/deleteTrafficMonitor.html","Deletes an traffic monitor host."
"Apache CloudStack","API 4.9","https://cloudstack.provider.com:[port]/client/api?command=deleteTrafficType&amp;[parameters of this command]","POST","http://cloudstack.apache.org/api/apidocs-4.9/apis/deleteTrafficType.html","Deletes traffic type of a physical network"
"Apache CloudStack","API 4.9","https://cloudstack.provider.com:[port]/client/api?command=deleteUcsManager&amp;[parameters of this command]","POST","http://cloudstack.apache.org/api/apidocs-4.9/apis/deleteUcsManager.html","Delete a Ucs manager"
"Apache CloudStack","API 4.9","https://cloudstack.provider.com:[port]/client/api?command=deleteUser&amp;[parameters of this command]","POST","http://cloudstack.apache.org/api/apidocs-4.9/apis/deleteUser.html","Deletes a user for an account"
"Apache CloudStack","API 4.9","https://cloudstack.provider.com:[port]/client/api?command=deleteVMSnapshot&amp;[parameters of this command]","POST","http://cloudstack.apache.org/api/apidocs-4.9/apis/deleteVMSnapshot.html","Deletes a vmsnapshot."
"Apache CloudStack","API 4.9","https://cloudstack.provider.com:[port]/client/api?command=deleteVPC&amp;[parameters of this command]","POST","http://cloudstack.apache.org/api/apidocs-4.9/apis/deleteVPC.html","Deletes a VPC"
"Apache CloudStack","API 4.9","https://cloudstack.provider.com:[port]/client/api?command=deleteVPCOffering&amp;[parameters of this command]","POST","http://cloudstack.apache.org/api/apidocs-4.9/apis/deleteVPCOffering.html","Deletes VPC offering"
"Apache CloudStack","API 4.9","https://cloudstack.provider.com:[port]/client/api?command=deleteVlanIpRange&amp;[parameters of this command]","POST","http://cloudstack.apache.org/api/apidocs-4.9/apis/deleteVlanIpRange.html","Creates a VLAN IP range."
"Apache CloudStack","API 4.9","https://cloudstack.provider.com:[port]/client/api?command=deleteVolume&amp;[parameters of this command]","POST","http://cloudstack.apache.org/api/apidocs-4.9/apis/deleteVolume.html","Deletes a detached disk volume."
"Apache CloudStack","API 4.9","https://cloudstack.provider.com:[port]/client/api?command=deleteVpnConnection&amp;[parameters of this command]","POST","http://cloudstack.apache.org/api/apidocs-4.9/apis/deleteVpnConnection.html","Delete site to site vpn connection"
"Apache CloudStack","API 4.9","https://cloudstack.provider.com:[port]/client/api?command=deleteVpnCustomerGateway&amp;[parameters of this command]","POST","http://cloudstack.apache.org/api/apidocs-4.9/apis/deleteVpnCustomerGateway.html","Delete site to site vpn customer gateway"
"Apache CloudStack","API 4.9","https://cloudstack.provider.com:[port]/client/api?command=deleteVpnGateway&amp;[parameters of this command]","POST","http://cloudstack.apache.org/api/apidocs-4.9/apis/deleteVpnGateway.html","Delete site to site vpn gateway"
"Apache CloudStack","API 4.9","https://cloudstack.provider.com:[port]/client/api?command=deleteZone&amp;[parameters of this command]","POST","http://cloudstack.apache.org/api/apidocs-4.9/apis/deleteZone.html","Deletes a Zone."
"Apache CloudStack","API 4.9","https://cloudstack.provider.com:[port]/client/api?command=deployVirtualMachine&amp;[parameters of this command]","POST","http://cloudstack.apache.org/api/apidocs-4.9/apis/deployVirtualMachine.html","Creates and automatically starts a virtual machine based on a service offering, disk offering, and template."
"Apache CloudStack","API 4.9","https://cloudstack.provider.com:[port]/client/api?command=destroyLunOnFiler&amp;[parameters of this command]","POST","http://cloudstack.apache.org/api/apidocs-4.9/apis/destroyLunOnFiler.html","Destroy a LUN"
"Apache CloudStack","API 4.9","https://cloudstack.provider.com:[port]/client/api?command=destroyRouter&amp;[parameters of this command]","POST","http://cloudstack.apache.org/api/apidocs-4.9/apis/destroyRouter.html","Destroys a router."
"Apache CloudStack","API 4.9","https://cloudstack.provider.com:[port]/client/api?command=destroySystemVm&amp;[parameters of this command]","POST","http://cloudstack.apache.org/api/apidocs-4.9/apis/destroySystemVm.html","Destroyes a system virtual machine."
"Apache CloudStack","API 4.9","https://cloudstack.provider.com:[port]/client/api?command=destroyVirtualMachine&amp;[parameters of this command]","POST","http://cloudstack.apache.org/api/apidocs-4.9/apis/destroyVirtualMachine.html","Destroys a virtual machine. Once destroyed, only the administrator can recover it."
"Apache CloudStack","API 4.9","https://cloudstack.provider.com:[port]/client/api?command=destroyVolumeOnFiler&amp;[parameters of this command]","POST","http://cloudstack.apache.org/api/apidocs-4.9/apis/destroyVolumeOnFiler.html","Destroy a Volume"
"Apache CloudStack","API 4.9","https://cloudstack.provider.com:[port]/client/api?command=detachIso&amp;[parameters of this command]","POST","http://cloudstack.apache.org/api/apidocs-4.9/apis/detachIso.html","Detaches any ISO file (if any) currently attached to a virtual machine."
"Apache CloudStack","API 4.9","https://cloudstack.provider.com:[port]/client/api?command=detachVolume&amp;[parameters of this command]","POST","http://cloudstack.apache.org/api/apidocs-4.9/apis/detachVolume.html","Detaches a disk volume from a virtual machine."
"Apache CloudStack","API 4.9","https://cloudstack.provider.com:[port]/client/api?command=disableAccount&amp;[parameters of this command]","POST","http://cloudstack.apache.org/api/apidocs-4.9/apis/disableAccount.html","Disables an account"
"Apache CloudStack","API 4.9","https://cloudstack.provider.com:[port]/client/api?command=disableAutoScaleVmGroup&amp;[parameters of this command]","POST","http://cloudstack.apache.org/api/apidocs-4.9/apis/disableAutoScaleVmGroup.html","Disables an AutoScale Vm Group"
"Apache CloudStack","API 4.9","https://cloudstack.provider.com:[port]/client/api?command=disableCiscoNexusVSM&amp;[parameters of this command]","POST","http://cloudstack.apache.org/api/apidocs-4.9/apis/disableCiscoNexusVSM.html","disable a Cisco Nexus VSM device"
"Apache CloudStack","API 4.9","https://cloudstack.provider.com:[port]/client/api?command=disableOutOfBandManagementForCluster&amp;[parameters of this command]","POST","http://cloudstack.apache.org/api/apidocs-4.9/apis/disableOutOfBandManagementForCluster.html","Disables out-of-band management for a cluster"
"Apache CloudStack","API 4.9","https://cloudstack.provider.com:[port]/client/api?command=disableOutOfBandManagementForHost&amp;[parameters of this command]","POST","http://cloudstack.apache.org/api/apidocs-4.9/apis/disableOutOfBandManagementForHost.html","Disables out-of-band management for a host"
"Apache CloudStack","API 4.9","https://cloudstack.provider.com:[port]/client/api?command=disableOutOfBandManagementForZone&amp;[parameters of this command]","POST","http://cloudstack.apache.org/api/apidocs-4.9/apis/disableOutOfBandManagementForZone.html","Disables out-of-band management for a zone"
"Apache CloudStack","API 4.9","https://cloudstack.provider.com:[port]/client/api?command=disableStaticNat&amp;[parameters of this command]","POST","http://cloudstack.apache.org/api/apidocs-4.9/apis/disableStaticNat.html","Disables static rule for given IP address"
"Apache CloudStack","API 4.9","https://cloudstack.provider.com:[port]/client/api?command=disableUser&amp;[parameters of this command]","POST","http://cloudstack.apache.org/api/apidocs-4.9/apis/disableUser.html","Disables a user account"
"Apache CloudStack","API 4.9","https://cloudstack.provider.com:[port]/client/api?command=disassociateIpAddress&amp;[parameters of this command]","POST","http://cloudstack.apache.org/api/apidocs-4.9/apis/disassociateIpAddress.html","Disassociates an IP address from the account."
"Apache CloudStack","API 4.9","https://cloudstack.provider.com:[port]/client/api?command=dissociateLun&amp;[parameters of this command]","POST","http://cloudstack.apache.org/api/apidocs-4.9/apis/dissociateLun.html","Dissociate a LUN"
"Apache CloudStack","API 4.9","https://cloudstack.provider.com:[port]/client/api?command=enableAccount&amp;[parameters of this command]","POST","http://cloudstack.apache.org/api/apidocs-4.9/apis/enableAccount.html","Enables an account"
"Apache CloudStack","API 4.9","https://cloudstack.provider.com:[port]/client/api?command=enableAutoScaleVmGroup&amp;[parameters of this command]","POST","http://cloudstack.apache.org/api/apidocs-4.9/apis/enableAutoScaleVmGroup.html","Enables an AutoScale Vm Group"
"Apache CloudStack","API 4.9","https://cloudstack.provider.com:[port]/client/api?command=enableCiscoNexusVSM&amp;[parameters of this command]","POST","http://cloudstack.apache.org/api/apidocs-4.9/apis/enableCiscoNexusVSM.html","Enable a Cisco Nexus VSM device"
"Apache CloudStack","API 4.9","https://cloudstack.provider.com:[port]/client/api?command=enableOutOfBandManagementForCluster&amp;[parameters of this command]","POST","http://cloudstack.apache.org/api/apidocs-4.9/apis/enableOutOfBandManagementForCluster.html","Enables out-of-band management for a cluster"
"Apache CloudStack","API 4.9","https://cloudstack.provider.com:[port]/client/api?command=enableOutOfBandManagementForHost&amp;[parameters of this command]","POST","http://cloudstack.apache.org/api/apidocs-4.9/apis/enableOutOfBandManagementForHost.html","Enables out-of-band management for a host"
"Apache CloudStack","API 4.9","https://cloudstack.provider.com:[port]/client/api?command=enableOutOfBandManagementForZone&amp;[parameters of this command]","POST","http://cloudstack.apache.org/api/apidocs-4.9/apis/enableOutOfBandManagementForZone.html","Enables out-of-band management for a zone"
"Apache CloudStack","API 4.9","https://cloudstack.provider.com:[port]/client/api?command=enableStaticNat&amp;[parameters of this command]","POST","http://cloudstack.apache.org/api/apidocs-4.9/apis/enableStaticNat.html","Enables static NAT for given IP address"
"Apache CloudStack","API 4.9","https://cloudstack.provider.com:[port]/client/api?command=enableStorageMaintenance&amp;[parameters of this command]","POST","http://cloudstack.apache.org/api/apidocs-4.9/apis/enableStorageMaintenance.html","Puts storage pool into maintenance state"
"Apache CloudStack","API 4.9","https://cloudstack.provider.com:[port]/client/api?command=enableUser&amp;[parameters of this command]","POST","http://cloudstack.apache.org/api/apidocs-4.9/apis/enableUser.html","Enables a user account"
"Apache CloudStack","API 4.9","https://cloudstack.provider.com:[port]/client/api?command=expungeVirtualMachine&amp;[parameters of this command]","POST","http://cloudstack.apache.org/api/apidocs-4.9/apis/expungeVirtualMachine.html","Expunge a virtual machine. Once expunged, it cannot be recoverd."
"Apache CloudStack","API 4.9","https://cloudstack.provider.com:[port]/client/api?command=extractIso&amp;[parameters of this command]","POST","http://cloudstack.apache.org/api/apidocs-4.9/apis/extractIso.html","Extracts an ISO"
"Apache CloudStack","API 4.9","https://cloudstack.provider.com:[port]/client/api?command=extractTemplate&amp;[parameters of this command]","POST","http://cloudstack.apache.org/api/apidocs-4.9/apis/extractTemplate.html","Extracts a template"
"Apache CloudStack","API 4.9","https://cloudstack.provider.com:[port]/client/api?command=extractVolume&amp;[parameters of this command]","POST","http://cloudstack.apache.org/api/apidocs-4.9/apis/extractVolume.html","Extracts volume"
"Apache CloudStack","API 4.9","https://cloudstack.provider.com:[port]/client/api?command=findHostsForMigration&amp;[parameters of this command]","POST","http://cloudstack.apache.org/api/apidocs-4.9/apis/findHostsForMigration.html","Find hosts suitable for migrating a virtual machine."
"Apache CloudStack","API 4.9","https://cloudstack.provider.com:[port]/client/api?command=findStoragePoolsForMigration&amp;[parameters of this command]","POST","http://cloudstack.apache.org/api/apidocs-4.9/apis/findStoragePoolsForMigration.html","Lists storage pools available for migration of a volume."
"Apache CloudStack","API 4.9","https://cloudstack.provider.com:[port]/client/api?command=generateAlert&amp;[parameters of this command]","POST","http://cloudstack.apache.org/api/apidocs-4.9/apis/generateAlert.html","Generates an alert"
"Apache CloudStack","API 4.9","https://cloudstack.provider.com:[port]/client/api?command=generateUsageRecords&amp;[parameters of this command]","POST","http://cloudstack.apache.org/api/apidocs-4.9/apis/generateUsageRecords.html","Generates usage records. This will generate records only if there any records to be generated, i.e if the scheduled usage job was not run or failed"
"Apache CloudStack","API 4.9","https://cloudstack.provider.com:[port]/client/api?command=getApiLimit&amp;[parameters of this command]","POST","http://cloudstack.apache.org/api/apidocs-4.9/apis/getApiLimit.html","Get API limit count for the caller"
"Apache CloudStack","API 4.9","https://cloudstack.provider.com:[port]/client/api?command=getCloudIdentifier&amp;[parameters of this command]","POST","http://cloudstack.apache.org/api/apidocs-4.9/apis/getCloudIdentifier.html","Retrieves a cloud identifier."
"Apache CloudStack","API 4.9","https://cloudstack.provider.com:[port]/client/api?command=getPathForVolume&amp;[parameters of this command]","POST","http://cloudstack.apache.org/api/apidocs-4.9/apis/getPathForVolume.html","Get the path associated with the provided volume UUID"
"Apache CloudStack","API 4.9","https://cloudstack.provider.com:[port]/client/api?command=getSPMetadata&amp;[parameters of this command]","POST","http://cloudstack.apache.org/api/apidocs-4.9/apis/getSPMetadata.html","Returns SAML2 CloudStack Service Provider MetaData"
"Apache CloudStack","API 4.9","https://cloudstack.provider.com:[port]/client/api?command=getSolidFireAccountId&amp;[parameters of this command]","POST","http://cloudstack.apache.org/api/apidocs-4.9/apis/getSolidFireAccountId.html","Get SolidFire Account ID"
"Apache CloudStack","API 4.9","https://cloudstack.provider.com:[port]/client/api?command=getSolidFireVolumeAccessGroupId&amp;[parameters of this command]","POST","http://cloudstack.apache.org/api/apidocs-4.9/apis/getSolidFireVolumeAccessGroupId.html","Get the SF Volume Access Group ID"
"Apache CloudStack","API 4.9","https://cloudstack.provider.com:[port]/client/api?command=getSolidFireVolumeSize&amp;[parameters of this command]","POST","http://cloudstack.apache.org/api/apidocs-4.9/apis/getSolidFireVolumeSize.html","Get the SF volume size including Hypervisor Snapshot Reserve"
"Apache CloudStack","API 4.9","https://cloudstack.provider.com:[port]/client/api?command=getUploadParamsForTemplate&amp;[parameters of this command]","POST","http://cloudstack.apache.org/api/apidocs-4.9/apis/getUploadParamsForTemplate.html","upload an existing template into the CloudStack cloud. "
"Apache CloudStack","API 4.9","https://cloudstack.provider.com:[port]/client/api?command=getUploadParamsForVolume&amp;[parameters of this command]","POST","http://cloudstack.apache.org/api/apidocs-4.9/apis/getUploadParamsForVolume.html","Upload a data disk to the cloudstack cloud."
"Apache CloudStack","API 4.9","https://cloudstack.provider.com:[port]/client/api?command=getUser&amp;[parameters of this command]","POST","http://cloudstack.apache.org/api/apidocs-4.9/apis/getUser.html","Find user account by API key"
"Apache CloudStack","API 4.9","https://cloudstack.provider.com:[port]/client/api?command=getVMPassword&amp;[parameters of this command]","POST","http://cloudstack.apache.org/api/apidocs-4.9/apis/getVMPassword.html","Returns an encrypted password for the VM"
"Apache CloudStack","API 4.9","https://cloudstack.provider.com:[port]/client/api?command=getVirtualMachineUserData&amp;[parameters of this command]","POST","http://cloudstack.apache.org/api/apidocs-4.9/apis/getVirtualMachineUserData.html","Returns user data associated with the VM"
"Apache CloudStack","API 4.9","https://cloudstack.provider.com:[port]/client/api?command=getVolumeSnapshotDetails&amp;[parameters of this command]","POST","http://cloudstack.apache.org/api/apidocs-4.9/apis/getVolumeSnapshotDetails.html","Get Volume Snapshot Details"
"Apache CloudStack","API 4.9","https://cloudstack.provider.com:[port]/client/api?command=getVolumeiScsiName&amp;[parameters of this command]","POST","http://cloudstack.apache.org/api/apidocs-4.9/apis/getVolumeiScsiName.html","Get Volume's iSCSI Name"
"Apache CloudStack","API 4.9","https://cloudstack.provider.com:[port]/client/api?command=importLdapUsers&amp;[parameters of this command]","POST","http://cloudstack.apache.org/api/apidocs-4.9/apis/importLdapUsers.html","Import LDAP users"
"Apache CloudStack","API 4.9","https://cloudstack.provider.com:[port]/client/api?command=issueOutOfBandManagementPowerAction&amp;[parameters of this command]","POST","http://cloudstack.apache.org/api/apidocs-4.9/apis/issueOutOfBandManagementPowerAction.html","Initiates the specified power action to the host's out-of-band management interface"
"Apache CloudStack","API 4.9","https://cloudstack.provider.com:[port]/client/api?command=ldapConfig&amp;[parameters of this command]","POST","http://cloudstack.apache.org/api/apidocs-4.9/apis/ldapConfig.html","Configure the LDAP context for this site."
"Apache CloudStack","API 4.9","https://cloudstack.provider.com:[port]/client/api?command=ldapCreateAccount&amp;[parameters of this command]","POST","http://cloudstack.apache.org/api/apidocs-4.9/apis/ldapCreateAccount.html","Creates an account from an LDAP user"
"Apache CloudStack","API 4.9","https://cloudstack.provider.com:[port]/client/api?command=ldapRemove&amp;[parameters of this command]","POST","http://cloudstack.apache.org/api/apidocs-4.9/apis/ldapRemove.html","Remove the LDAP context for this site."
"Apache CloudStack","API 4.9","https://cloudstack.provider.com:[port]/client/api?command=linkDomainToLdap&amp;[parameters of this command]","POST","http://cloudstack.apache.org/api/apidocs-4.9/apis/linkDomainToLdap.html","link an existing cloudstack domain to group or OU in ldap"
"Apache CloudStack","API 4.9","https://cloudstack.provider.com:[port]/client/api?command=listAccounts&amp;[parameters of this command]","POST","http://cloudstack.apache.org/api/apidocs-4.9/apis/listAccounts.html","Lists accounts and provides detailed account information for listed accounts"
"Apache CloudStack","API 4.9","https://cloudstack.provider.com:[port]/client/api?command=listAffinityGroupTypes&amp;[parameters of this command]","POST","http://cloudstack.apache.org/api/apidocs-4.9/apis/listAffinityGroupTypes.html","Lists affinity group types available"
"Apache CloudStack","API 4.9","https://cloudstack.provider.com:[port]/client/api?command=listAffinityGroups&amp;[parameters of this command]","POST","http://cloudstack.apache.org/api/apidocs-4.9/apis/listAffinityGroups.html","Lists affinity groups"
"Apache CloudStack","API 4.9","https://cloudstack.provider.com:[port]/client/api?command=listAlerts&amp;[parameters of this command]","POST","http://cloudstack.apache.org/api/apidocs-4.9/apis/listAlerts.html","Lists all alerts."
"Apache CloudStack","API 4.9","https://cloudstack.provider.com:[port]/client/api?command=listAndSwitchSamlAccount&amp;[parameters of this command]","POST","http://cloudstack.apache.org/api/apidocs-4.9/apis/listAndSwitchSamlAccount.html","Lists and switches to other SAML accounts owned by the SAML user"
"Apache CloudStack","API 4.9","https://cloudstack.provider.com:[port]/client/api?command=listApis&amp;[parameters of this command]","POST","http://cloudstack.apache.org/api/apidocs-4.9/apis/listApis.html","lists all available apis on the server, provided by the Api Discovery plugin"
"Apache CloudStack","API 4.9","https://cloudstack.provider.com:[port]/client/api?command=listAsyncJobs&amp;[parameters of this command]","POST","http://cloudstack.apache.org/api/apidocs-4.9/apis/listAsyncJobs.html","Lists all pending asynchronous jobs for the account."
"Apache CloudStack","API 4.9","https://cloudstack.provider.com:[port]/client/api?command=listAutoScalePolicies&amp;[parameters of this command]","POST","http://cloudstack.apache.org/api/apidocs-4.9/apis/listAutoScalePolicies.html","Lists autoscale policies."
"Apache CloudStack","API 4.9","https://cloudstack.provider.com:[port]/client/api?command=listAutoScaleVmGroups&amp;[parameters of this command]","POST","http://cloudstack.apache.org/api/apidocs-4.9/apis/listAutoScaleVmGroups.html","Lists autoscale vm groups."
"Apache CloudStack","API 4.9","https://cloudstack.provider.com:[port]/client/api?command=listAutoScaleVmProfiles&amp;[parameters of this command]","POST","http://cloudstack.apache.org/api/apidocs-4.9/apis/listAutoScaleVmProfiles.html","Lists autoscale vm profiles."
"Apache CloudStack","API 4.9","https://cloudstack.provider.com:[port]/client/api?command=listBaremetalDhcp&amp;[parameters of this command]","POST","http://cloudstack.apache.org/api/apidocs-4.9/apis/listBaremetalDhcp.html","list baremetal dhcp servers"
"Apache CloudStack","API 4.9","https://cloudstack.provider.com:[port]/client/api?command=listBaremetalPxeServers&amp;[parameters of this command]","POST","http://cloudstack.apache.org/api/apidocs-4.9/apis/listBaremetalPxeServers.html","list baremetal pxe server"
