Amazon Web Services,AWSMigrationHub,RESOURCE,AssociateCreatedArtifact,POST,/associatecreatedartifact,Associates a created artifact of an AWS cloud resource, the target receiving the migration, with the migration task performed by a migration tool. This API has the following traits:   Migration tools can call the AssociateCreatedArtifact operation to indicate which AWS artifact is associated with a migration task.   The created artifact name must be provided in ARN (Amazon Resource Name) format which will contain information about type and region; for example: arn:aws:ec2:us-east-1:488216288981:image/ami-6d0ba87b.   Examples of the AWS resource behind the created artifact are, AMI's, EC2 instance, or DMS endpoint, etc.  ,https://raw.githubusercontent.com/aws/aws-sdk-js/master/apis/AWSMigrationHub-2017-05-31.normal.json
Amazon Web Services,AWSMigrationHub,RESOURCE,AssociateDiscoveredResource,POST,/associatediscoveredresource,Associates a discovered resource ID from Application Discovery Service (ADS) with a migration task.,https://raw.githubusercontent.com/aws/aws-sdk-js/master/apis/AWSMigrationHub-2017-05-31.normal.json
Amazon Web Services,AWSMigrationHub,RESOURCE,CreateProgressUpdateStream,POST,/createprogressupdatestream,Creates a progress update stream which is an AWS resource used for access control as well as a namespace for migration task names that is implicitly linked to your AWS account. It must uniquely identify the migration tool as it is used for all updates made by the tool; however, it does not need to be unique for each AWS account because it is scoped to the AWS account.,https://raw.githubusercontent.com/aws/aws-sdk-js/master/apis/AWSMigrationHub-2017-05-31.normal.json
Amazon Web Services,AWSMigrationHub,RESOURCE,DeleteProgressUpdateStream,POST,/deleteprogressupdatestream,Deletes a progress update stream, including all of its tasks, which was previously created as an AWS resource used for access control. This API has the following traits:   The only parameter needed for DeleteProgressUpdateStream is the stream name (same as a CreateProgressUpdateStream call).   The call will return, and a background process will asynchronously be doing the actual delete of the stream and all of its resources (tasks, associated resources, resource attributes, created artifacts).   If the stream takes time to be deleted, it might still show up on a ListProgressUpdateStreams call.    CreateProgressUpdateStream, ImportMigrationTask, NotifyMigrationTaskState, and all Associate[*] APIs realted to the tasks belonging to the stream will throw "InvalidInputException" if the stream of the same name is in the process of being deleted.   Once the stream and all of its resources are deleted, CreateProgressUpdateStream for a stream of the same name will succeed, and that stream will be an entirely new logical resource (without any resources associated with the old stream).  ,https://raw.githubusercontent.com/aws/aws-sdk-js/master/apis/AWSMigrationHub-2017-05-31.normal.json
Amazon Web Services,AWSMigrationHub,RESOURCE,DescribeApplicationState,POST,/describeapplicationstate,Gets the migration status of an application.,https://raw.githubusercontent.com/aws/aws-sdk-js/master/apis/AWSMigrationHub-2017-05-31.normal.json
Amazon Web Services,AWSMigrationHub,RESOURCE,DescribeMigrationTask,POST,/describemigrationtask,Retrieves a list of all attributes associated with a specific migration task.,https://raw.githubusercontent.com/aws/aws-sdk-js/master/apis/AWSMigrationHub-2017-05-31.normal.json
Amazon Web Services,AWSMigrationHub,RESOURCE,DisassociateCreatedArtifact,POST,/disassociatecreatedartifact,Disassociates a created artifact of an AWS resource with a migration task performed by a migration tool that was previously associated. This API has the following traits:   A migration user can call the DisassociateCreatedArtifacts operation to disassociate a created AWS Artifact from a migration task.   The created artifact name must be provided in ARN (Amazon Resource Name) format which will contain information about type and region; for example: arn:aws:ec2:us-east-1:488216288981:image/ami-6d0ba87b.   Examples of the AWS resource behind the created artifact are, AMI's, EC2 instance, or RDS instance, etc.  ,https://raw.githubusercontent.com/aws/aws-sdk-js/master/apis/AWSMigrationHub-2017-05-31.normal.json
Amazon Web Services,AWSMigrationHub,RESOURCE,DisassociateDiscoveredResource,POST,/disassociatediscoveredresource,Disassociate an Application Discovery Service (ADS) discovered resource from a migration task.,https://raw.githubusercontent.com/aws/aws-sdk-js/master/apis/AWSMigrationHub-2017-05-31.normal.json
Amazon Web Services,AWSMigrationHub,RESOURCE,ImportMigrationTask,POST,/importmigrationtask,Registers a new migration task which represents a server, database, etc., being migrated to AWS by a migration tool. This API is a prerequisite to calling the NotifyMigrationTaskState API as the migration tool must first register the migration task with Migration Hub.,https://raw.githubusercontent.com/aws/aws-sdk-js/master/apis/AWSMigrationHub-2017-05-31.normal.json
Amazon Web Services,AWSMigrationHub,RESOURCE,ListCreatedArtifacts,POST,/listcreatedartifacts,Lists the created artifacts attached to a given migration task in an update stream. This API has the following traits:   Gets the list of the created artifacts while migration is taking place.   Shows the artifacts created by the migration tool that was associated by the AssociateCreatedArtifact API.    Lists created artifacts in a paginated interface.   ,https://raw.githubusercontent.com/aws/aws-sdk-js/master/apis/AWSMigrationHub-2017-05-31.normal.json
Amazon Web Services,AWSMigrationHub,RESOURCE,ListDiscoveredResources,POST,/listdiscoveredresources,Lists discovered resources associated with the given MigrationTask.,https://raw.githubusercontent.com/aws/aws-sdk-js/master/apis/AWSMigrationHub-2017-05-31.normal.json
Amazon Web Services,AWSMigrationHub,RESOURCE,ListMigrationTasks,POST,/listmigrationtasks,Lists all, or filtered by resource name, migration tasks associated with the user account making this call. This API has the following traits:   Can show a summary list of the most recent migration tasks.   Can show a summary list of migration tasks associated with a given discovered resource.   Lists migration tasks in a paginated interface.  ,https://raw.githubusercontent.com/aws/aws-sdk-js/master/apis/AWSMigrationHub-2017-05-31.normal.json
Amazon Web Services,AWSMigrationHub,RESOURCE,ListProgressUpdateStreams,POST,/listprogressupdatestreams,Lists progress update streams associated with the user account making this call.,https://raw.githubusercontent.com/aws/aws-sdk-js/master/apis/AWSMigrationHub-2017-05-31.normal.json
Amazon Web Services,AWSMigrationHub,RESOURCE,NotifyApplicationState,POST,/notifyapplicationstate,Sets the migration state of an application. For a given application identified by the value passed to ApplicationId, its status is set or updated by passing one of three values to Status: NOT_STARTED | IN_PROGRESS | COMPLETED.,https://raw.githubusercontent.com/aws/aws-sdk-js/master/apis/AWSMigrationHub-2017-05-31.normal.json
Amazon Web Services,AWSMigrationHub,RESOURCE,NotifyMigrationTaskState,POST,/notifymigrationtaskstate,Notifies Migration Hub of the current status, progress, or other detail regarding a migration task. This API has the following traits:   Migration tools will call the NotifyMigrationTaskState API to share the latest progress and status.    MigrationTaskName is used for addressing updates to the correct target.    ProgressUpdateStream is used for access control and to provide a namespace for each migration tool.  ,https://raw.githubusercontent.com/aws/aws-sdk-js/master/apis/AWSMigrationHub-2017-05-31.normal.json
Amazon Web Services,AWSMigrationHub,RESOURCE,PutResourceAttributes,POST,/putresourceattributes,Provides identifying details of the resource being migrated so that it can be associated in the Application Discovery Service (ADS)'s repository. This association occurs asynchronously after PutResourceAttributes returns.  Keep in mind that subsequent calls to PutResourceAttributes will override previously stored attributes. For example, if it is first called with a MAC address, but later, it is desired to add an IP address, it will then be required to call it with both the IP and MAC addresses to prevent overiding the MAC address.   Because this is an asynchronous call, it will always return 200, whether an association occurs or not. To confirm if an association was found based on the provided details, call ListAssociatedResource. ,https://raw.githubusercontent.com/aws/aws-sdk-js/master/apis/AWSMigrationHub-2017-05-31.normal.json
Amazon Web Services,acm,RESOURCE,AddTagsToCertificate,POST,/addtagstocertificate,Adds one or more tags to an ACM Certificate. Tags are labels that you can use to identify and organize your AWS resources. Each tag consists of a key and an optional value. You specify the certificate on input by its Amazon Resource Name (ARN). You specify the tag by using a key-value pair. You can apply a tag to just one certificate if you want to identify a specific characteristic of that certificate, or you can apply the same tag to multiple certificates if you want to filter for a common relationship among those certificates. Similarly, you can apply the same tag to multiple resources if you want to specify a relationship among those resources. For example, you can add the same tag to an ACM Certificate and an Elastic Load Balancing load balancer to indicate that they are both used by the same website. For more information, see Tagging ACM Certificates. To remove one or more tags, use the RemoveTagsFromCertificate action. To view all of the tags that have been applied to the certificate, use the ListTagsForCertificate action.,https://raw.githubusercontent.com/aws/aws-sdk-js/master/apis/acm-2015-12-08.normal.json
Amazon Web Services,acm,RESOURCE,DeleteCertificate,POST,/deletecertificate,Deletes an ACM Certificate and its associated private key. If this action succeeds, the certificate no longer appears in the list of ACM Certificates that can be displayed by calling the ListCertificates action or be retrieved by calling the GetCertificate action. The certificate will not be available for use by other AWS services.  You cannot delete an ACM Certificate that is being used by another AWS service. To delete a certificate that is in use, the certificate association must first be removed. ,https://raw.githubusercontent.com/aws/aws-sdk-js/master/apis/acm-2015-12-08.normal.json
Amazon Web Services,acm,RESOURCE,DescribeCertificate,POST,/describecertificate,Returns detailed metadata about the specified ACM Certificate.,https://raw.githubusercontent.com/aws/aws-sdk-js/master/apis/acm-2015-12-08.normal.json
Amazon Web Services,acm,RESOURCE,GetCertificate,POST,/getcertificate,Retrieves an ACM Certificate and certificate chain for the certificate specified by an ARN. The chain is an ordered list of certificates that contains the root certificate, intermediate certificates of subordinate CAs, and the ACM Certificate. The certificate and certificate chain are base64 encoded. If you want to decode the certificate chain to see the individual certificate fields, you can use OpenSSL.  Currently, ACM Certificates can be used only with Elastic Load Balancing and Amazon CloudFront. ,https://raw.githubusercontent.com/aws/aws-sdk-js/master/apis/acm-2015-12-08.normal.json
Amazon Web Services,acm,RESOURCE,ImportCertificate,POST,/importcertificate,Imports an SSL/TLS certificate into AWS Certificate Manager (ACM) to use with ACM's integrated AWS services.  ACM does not provide managed renewal for certificates that you import.  For more information about importing certificates into ACM, including the differences between certificates that you import and those that ACM provides, see Importing Certificates in the AWS Certificate Manager User Guide. To import a certificate, you must provide the certificate and the matching private key. When the certificate is not self-signed, you must also provide a certificate chain. You can omit the certificate chain when importing a self-signed certificate. The certificate, private key, and certificate chain must be PEM-encoded. For more information about converting these items to PEM format, see Importing Certificates Troubleshooting in the AWS Certificate Manager User Guide. To import a new certificate, omit the CertificateArn field. Include this field only when you want to replace a previously imported certificate. This operation returns the Amazon Resource Name (ARN) of the imported certificate.,https://raw.githubusercontent.com/aws/aws-sdk-js/master/apis/acm-2015-12-08.normal.json
Amazon Web Services,acm,RESOURCE,ListCertificates,POST,/listcertificates,Retrieves a list of ACM Certificates and the domain name for each. You can optionally filter the list to return only the certificates that match the specified status.,https://raw.githubusercontent.com/aws/aws-sdk-js/master/apis/acm-2015-12-08.normal.json
Amazon Web Services,acm,RESOURCE,ListTagsForCertificate,POST,/listtagsforcertificate,Lists the tags that have been applied to the ACM Certificate. Use the certificate's Amazon Resource Name (ARN) to specify the certificate. To add a tag to an ACM Certificate, use the AddTagsToCertificate action. To delete a tag, use the RemoveTagsFromCertificate action.,https://raw.githubusercontent.com/aws/aws-sdk-js/master/apis/acm-2015-12-08.normal.json
Amazon Web Services,acm,RESOURCE,RemoveTagsFromCertificate,POST,/removetagsfromcertificate,Remove one or more tags from an ACM Certificate. A tag consists of a key-value pair. If you do not specify the value portion of the tag when calling this function, the tag will be removed regardless of value. If you specify a value, the tag is removed only if it is associated with the specified value. To add tags to a certificate, use the AddTagsToCertificate action. To view all of the tags that have been applied to a specific ACM Certificate, use the ListTagsForCertificate action.,https://raw.githubusercontent.com/aws/aws-sdk-js/master/apis/acm-2015-12-08.normal.json
Amazon Web Services,acm,RESOURCE,RequestCertificate,POST,/requestcertificate,Requests an ACM Certificate for use with other AWS services. To request an ACM Certificate, you must specify the fully qualified domain name (FQDN) for your site. You can also specify additional FQDNs if users can reach your site by using other names. For each domain name you specify, email is sent to the domain owner to request approval to issue the certificate. After receiving approval from the domain owner, the ACM Certificate is issued. For more information, see the AWS Certificate Manager User Guide.,https://raw.githubusercontent.com/aws/aws-sdk-js/master/apis/acm-2015-12-08.normal.json
Amazon Web Services,acm,RESOURCE,ResendValidationEmail,POST,/resendvalidationemail,Resends the email that requests domain ownership validation. The domain owner or an authorized representative must approve the ACM Certificate before it can be issued. The certificate can be approved by clicking a link in the mail to navigate to the Amazon certificate approval website and then clicking I Approve. However, the validation email can be blocked by spam filters. Therefore, if you do not receive the original mail, you can request that the mail be resent within 72 hours of requesting the ACM Certificate. If more than 72 hours have elapsed since your original request or since your last attempt to resend validation mail, you must request a new certificate. For more information about setting up your contact email addresses, see Configure Email for your Domain. ,https://raw.githubusercontent.com/aws/aws-sdk-js/master/apis/acm-2015-12-08.normal.json
Amazon Web Services,apigateway,RESOURCE,CreateApiKey,POST,/apikeys,Create an ApiKey resource.  AWS CLI,https://raw.githubusercontent.com/aws/aws-sdk-js/master/apis/apigateway-2015-07-09.normal.json
Amazon Web Services,apigateway,RESOURCE,CreateAuthorizer,POST,/restapis/{restapi_id}/authorizers,Adds a new Authorizer resource to an existing RestApi resource. AWS CLI,https://raw.githubusercontent.com/aws/aws-sdk-js/master/apis/apigateway-2015-07-09.normal.json
Amazon Web Services,apigateway,RESOURCE,CreateBasePathMapping,POST,/domainnames/{domain_name}/basepathmappings,Creates a new BasePathMapping resource.,https://raw.githubusercontent.com/aws/aws-sdk-js/master/apis/apigateway-2015-07-09.normal.json
Amazon Web Services,apigateway,RESOURCE,CreateDeployment,POST,/restapis/{restapi_id}/deployments,Creates a Deployment resource, which makes a specified RestApi callable over the internet.,https://raw.githubusercontent.com/aws/aws-sdk-js/master/apis/apigateway-2015-07-09.normal.json
Amazon Web Services,apigateway,RESOURCE,CreateDocumentationPart,POST,/restapis/{restapi_id}/documentation/parts,No description,https://raw.githubusercontent.com/aws/aws-sdk-js/master/apis/apigateway-2015-07-09.normal.json
Amazon Web Services,apigateway,RESOURCE,CreateDocumentationVersion,POST,/restapis/{restapi_id}/documentation/versions,No description,https://raw.githubusercontent.com/aws/aws-sdk-js/master/apis/apigateway-2015-07-09.normal.json
Amazon Web Services,apigateway,RESOURCE,CreateDomainName,POST,/domainnames,Creates a new domain name.,https://raw.githubusercontent.com/aws/aws-sdk-js/master/apis/apigateway-2015-07-09.normal.json
Amazon Web Services,apigateway,RESOURCE,CreateModel,POST,/restapis/{restapi_id}/models,Adds a new Model resource to an existing RestApi resource.,https://raw.githubusercontent.com/aws/aws-sdk-js/master/apis/apigateway-2015-07-09.normal.json
Amazon Web Services,apigateway,RESOURCE,CreateRequestValidator,POST,/restapis/{restapi_id}/requestvalidators,Creates a ReqeustValidator of a given RestApi.,https://raw.githubusercontent.com/aws/aws-sdk-js/master/apis/apigateway-2015-07-09.normal.json
Amazon Web Services,apigateway,RESOURCE,CreateResource,POST,/restapis/{restapi_id}/resources/{parent_id},Creates a Resource resource.,https://raw.githubusercontent.com/aws/aws-sdk-js/master/apis/apigateway-2015-07-09.normal.json
Amazon Web Services,apigateway,RESOURCE,CreateRestApi,POST,/restapis,Creates a new RestApi resource.,https://raw.githubusercontent.com/aws/aws-sdk-js/master/apis/apigateway-2015-07-09.normal.json
Amazon Web Services,apigateway,RESOURCE,CreateStage,POST,/restapis/{restapi_id}/stages,Creates a new Stage resource that references a pre-existing Deployment for the API. ,https://raw.githubusercontent.com/aws/aws-sdk-js/master/apis/apigateway-2015-07-09.normal.json
Amazon Web Services,apigateway,RESOURCE,CreateUsagePlan,POST,/usageplans,Creates a usage plan with the throttle and quota limits, as well as the associated API stages, specified in the payload. ,https://raw.githubusercontent.com/aws/aws-sdk-js/master/apis/apigateway-2015-07-09.normal.json
Amazon Web Services,apigateway,RESOURCE,CreateUsagePlanKey,POST,/usageplans/{usageplanId}/keys,Creates a usage plan key for adding an existing API key to a usage plan.,https://raw.githubusercontent.com/aws/aws-sdk-js/master/apis/apigateway-2015-07-09.normal.json
Amazon Web Services,apigateway,RESOURCE,DeleteApiKey,DELETE,/apikeys/{api_Key},Deletes the ApiKey resource.,https://raw.githubusercontent.com/aws/aws-sdk-js/master/apis/apigateway-2015-07-09.normal.json
Amazon Web Services,apigateway,RESOURCE,DeleteAuthorizer,DELETE,/restapis/{restapi_id}/authorizers/{authorizer_id},Deletes an existing Authorizer resource. AWS CLI,https://raw.githubusercontent.com/aws/aws-sdk-js/master/apis/apigateway-2015-07-09.normal.json
Amazon Web Services,apigateway,RESOURCE,DeleteBasePathMapping,DELETE,/domainnames/{domain_name}/basepathmappings/{base_path},Deletes the BasePathMapping resource.,https://raw.githubusercontent.com/aws/aws-sdk-js/master/apis/apigateway-2015-07-09.normal.json
Amazon Web Services,apigateway,RESOURCE,DeleteClientCertificate,DELETE,/clientcertificates/{clientcertificate_id},Deletes the ClientCertificate resource.,https://raw.githubusercontent.com/aws/aws-sdk-js/master/apis/apigateway-2015-07-09.normal.json
Amazon Web Services,apigateway,RESOURCE,DeleteDeployment,DELETE,/restapis/{restapi_id}/deployments/{deployment_id},Deletes a Deployment resource. Deleting a deployment will only succeed if there are no Stage resources associated with it.,https://raw.githubusercontent.com/aws/aws-sdk-js/master/apis/apigateway-2015-07-09.normal.json
Amazon Web Services,apigateway,RESOURCE,DeleteDocumentationPart,DELETE,/restapis/{restapi_id}/documentation/parts/{part_id},No description,https://raw.githubusercontent.com/aws/aws-sdk-js/master/apis/apigateway-2015-07-09.normal.json
Amazon Web Services,apigateway,RESOURCE,DeleteDocumentationVersion,DELETE,/restapis/{restapi_id}/documentation/versions/{doc_version},No description,https://raw.githubusercontent.com/aws/aws-sdk-js/master/apis/apigateway-2015-07-09.normal.json
Amazon Web Services,apigateway,RESOURCE,DeleteDomainName,DELETE,/domainnames/{domain_name},Deletes the DomainName resource.,https://raw.githubusercontent.com/aws/aws-sdk-js/master/apis/apigateway-2015-07-09.normal.json
Amazon Web Services,apigateway,RESOURCE,DeleteGatewayResponse,DELETE,/restapis/{restapi_id}/gatewayresponses/{response_type},Clears any customization of a GatewayResponse of a specified response type on the given RestApi and resets it with the default settings.,https://raw.githubusercontent.com/aws/aws-sdk-js/master/apis/apigateway-2015-07-09.normal.json
Amazon Web Services,apigateway,RESOURCE,DeleteIntegration,DELETE,/restapis/{restapi_id}/resources/{resource_id}/methods/{http_method}/integration,Represents a delete integration.,https://raw.githubusercontent.com/aws/aws-sdk-js/master/apis/apigateway-2015-07-09.normal.json
Amazon Web Services,apigateway,RESOURCE,DeleteIntegrationResponse,DELETE,/restapis/{restapi_id}/resources/{resource_id}/methods/{http_method}/integration/responses/{status_code},Represents a delete integration response.,https://raw.githubusercontent.com/aws/aws-sdk-js/master/apis/apigateway-2015-07-09.normal.json
Amazon Web Services,apigateway,RESOURCE,DeleteMethod,DELETE,/restapis/{restapi_id}/resources/{resource_id}/methods/{http_method},Deletes an existing Method resource.,https://raw.githubusercontent.com/aws/aws-sdk-js/master/apis/apigateway-2015-07-09.normal.json
Amazon Web Services,apigateway,RESOURCE,DeleteMethodResponse,DELETE,/restapis/{restapi_id}/resources/{resource_id}/methods/{http_method}/responses/{status_code},Deletes an existing MethodResponse resource.,https://raw.githubusercontent.com/aws/aws-sdk-js/master/apis/apigateway-2015-07-09.normal.json
Amazon Web Services,apigateway,RESOURCE,DeleteModel,DELETE,/restapis/{restapi_id}/models/{model_name},Deletes a model.,https://raw.githubusercontent.com/aws/aws-sdk-js/master/apis/apigateway-2015-07-09.normal.json
Amazon Web Services,apigateway,RESOURCE,DeleteRequestValidator,DELETE,/restapis/{restapi_id}/requestvalidators/{requestvalidator_id},Deletes a RequestValidator of a given RestApi.,https://raw.githubusercontent.com/aws/aws-sdk-js/master/apis/apigateway-2015-07-09.normal.json
Amazon Web Services,apigateway,RESOURCE,DeleteResource,DELETE,/restapis/{restapi_id}/resources/{resource_id},Deletes a Resource resource.,https://raw.githubusercontent.com/aws/aws-sdk-js/master/apis/apigateway-2015-07-09.normal.json
Amazon Web Services,apigateway,RESOURCE,DeleteRestApi,DELETE,/restapis/{restapi_id},Deletes the specified API.,https://raw.githubusercontent.com/aws/aws-sdk-js/master/apis/apigateway-2015-07-09.normal.json
Amazon Web Services,apigateway,RESOURCE,DeleteStage,DELETE,/restapis/{restapi_id}/stages/{stage_name},Deletes a Stage resource.,https://raw.githubusercontent.com/aws/aws-sdk-js/master/apis/apigateway-2015-07-09.normal.json
Amazon Web Services,apigateway,RESOURCE,DeleteUsagePlan,DELETE,/usageplans/{usageplanId},Deletes a usage plan of a given plan Id.,https://raw.githubusercontent.com/aws/aws-sdk-js/master/apis/apigateway-2015-07-09.normal.json
Amazon Web Services,apigateway,RESOURCE,DeleteUsagePlanKey,DELETE,/usageplans/{usageplanId}/keys/{keyId},Deletes a usage plan key and remove the underlying API key from the associated usage plan.,https://raw.githubusercontent.com/aws/aws-sdk-js/master/apis/apigateway-2015-07-09.normal.json
Amazon Web Services,apigateway,RESOURCE,FlushStageAuthorizersCache,DELETE,/restapis/{restapi_id}/stages/{stage_name}/cache/authorizers,Flushes all authorizer cache entries on a stage.,https://raw.githubusercontent.com/aws/aws-sdk-js/master/apis/apigateway-2015-07-09.normal.json
Amazon Web Services,apigateway,RESOURCE,FlushStageCache,DELETE,/restapis/{restapi_id}/stages/{stage_name}/cache/data,Flushes a stage's cache.,https://raw.githubusercontent.com/aws/aws-sdk-js/master/apis/apigateway-2015-07-09.normal.json
Amazon Web Services,apigateway,RESOURCE,GenerateClientCertificate,POST,/clientcertificates,Generates a ClientCertificate resource.,https://raw.githubusercontent.com/aws/aws-sdk-js/master/apis/apigateway-2015-07-09.normal.json
Amazon Web Services,apigateway,RESOURCE,GetAccount,GET,/account,Gets information about the current Account resource.,https://raw.githubusercontent.com/aws/aws-sdk-js/master/apis/apigateway-2015-07-09.normal.json
Amazon Web Services,apigateway,RESOURCE,GetApiKey,GET,/apikeys/{api_Key},Gets information about the current ApiKey resource.,https://raw.githubusercontent.com/aws/aws-sdk-js/master/apis/apigateway-2015-07-09.normal.json
Amazon Web Services,apigateway,RESOURCE,GetApiKeys,GET,/apikeys,Gets information about the current ApiKeys resource.,https://raw.githubusercontent.com/aws/aws-sdk-js/master/apis/apigateway-2015-07-09.normal.json
