Amazon Web Services,codedeploy,RESOURCE,CreateApplication,POST,/createapplication,Creates an application.,https://raw.githubusercontent.com/aws/aws-sdk-js/master/apis/codedeploy-2014-10-06.normal.json
Amazon Web Services,codedeploy,RESOURCE,CreateDeployment,POST,/createdeployment,Deploys an application revision through the specified deployment group.,https://raw.githubusercontent.com/aws/aws-sdk-js/master/apis/codedeploy-2014-10-06.normal.json
Amazon Web Services,codedeploy,RESOURCE,CreateDeploymentConfig,POST,/createdeploymentconfig,Creates a deployment configuration.,https://raw.githubusercontent.com/aws/aws-sdk-js/master/apis/codedeploy-2014-10-06.normal.json
Amazon Web Services,codedeploy,RESOURCE,CreateDeploymentGroup,POST,/createdeploymentgroup,Creates a deployment group to which application revisions will be deployed.,https://raw.githubusercontent.com/aws/aws-sdk-js/master/apis/codedeploy-2014-10-06.normal.json
Amazon Web Services,codedeploy,RESOURCE,DeleteApplication,POST,/deleteapplication,Deletes an application.,https://raw.githubusercontent.com/aws/aws-sdk-js/master/apis/codedeploy-2014-10-06.normal.json
Amazon Web Services,codedeploy,RESOURCE,DeleteDeploymentConfig,POST,/deletedeploymentconfig,Deletes a deployment configuration.  A deployment configuration cannot be deleted if it is currently in use. Predefined configurations cannot be deleted. ,https://raw.githubusercontent.com/aws/aws-sdk-js/master/apis/codedeploy-2014-10-06.normal.json
Amazon Web Services,codedeploy,RESOURCE,DeleteDeploymentGroup,POST,/deletedeploymentgroup,Deletes a deployment group.,https://raw.githubusercontent.com/aws/aws-sdk-js/master/apis/codedeploy-2014-10-06.normal.json
Amazon Web Services,codedeploy,RESOURCE,DeregisterOnPremisesInstance,POST,/deregisteronpremisesinstance,Deregisters an on-premises instance.,https://raw.githubusercontent.com/aws/aws-sdk-js/master/apis/codedeploy-2014-10-06.normal.json
Amazon Web Services,codedeploy,RESOURCE,GetApplication,POST,/getapplication,Gets information about an application.,https://raw.githubusercontent.com/aws/aws-sdk-js/master/apis/codedeploy-2014-10-06.normal.json
Amazon Web Services,codedeploy,RESOURCE,GetApplicationRevision,POST,/getapplicationrevision,Gets information about an application revision.,https://raw.githubusercontent.com/aws/aws-sdk-js/master/apis/codedeploy-2014-10-06.normal.json
Amazon Web Services,codedeploy,RESOURCE,GetDeployment,POST,/getdeployment,Gets information about a deployment.,https://raw.githubusercontent.com/aws/aws-sdk-js/master/apis/codedeploy-2014-10-06.normal.json
Amazon Web Services,codedeploy,RESOURCE,GetDeploymentConfig,POST,/getdeploymentconfig,Gets information about a deployment configuration.,https://raw.githubusercontent.com/aws/aws-sdk-js/master/apis/codedeploy-2014-10-06.normal.json
Amazon Web Services,codedeploy,RESOURCE,GetDeploymentGroup,POST,/getdeploymentgroup,Gets information about a deployment group.,https://raw.githubusercontent.com/aws/aws-sdk-js/master/apis/codedeploy-2014-10-06.normal.json
Amazon Web Services,codedeploy,RESOURCE,GetDeploymentInstance,POST,/getdeploymentinstance,Gets information about an instance as part of a deployment.,https://raw.githubusercontent.com/aws/aws-sdk-js/master/apis/codedeploy-2014-10-06.normal.json
Amazon Web Services,codedeploy,RESOURCE,GetOnPremisesInstance,POST,/getonpremisesinstance,Gets information about an on-premises instance.,https://raw.githubusercontent.com/aws/aws-sdk-js/master/apis/codedeploy-2014-10-06.normal.json
Amazon Web Services,codedeploy,RESOURCE,ListApplicationRevisions,POST,/listapplicationrevisions,Lists information about revisions for an application.,https://raw.githubusercontent.com/aws/aws-sdk-js/master/apis/codedeploy-2014-10-06.normal.json
Amazon Web Services,codedeploy,RESOURCE,ListApplications,POST,/listapplications,Lists the applications registered with the applicable IAM user or AWS account.,https://raw.githubusercontent.com/aws/aws-sdk-js/master/apis/codedeploy-2014-10-06.normal.json
Amazon Web Services,codedeploy,RESOURCE,ListDeploymentConfigs,POST,/listdeploymentconfigs,Lists the deployment configurations with the applicable IAM user or AWS account.,https://raw.githubusercontent.com/aws/aws-sdk-js/master/apis/codedeploy-2014-10-06.normal.json
Amazon Web Services,codedeploy,RESOURCE,ListDeploymentGroups,POST,/listdeploymentgroups,Lists the deployment groups for an application registered with the applicable IAM user or AWS account.,https://raw.githubusercontent.com/aws/aws-sdk-js/master/apis/codedeploy-2014-10-06.normal.json
Amazon Web Services,codedeploy,RESOURCE,ListDeploymentInstances,POST,/listdeploymentinstances,Lists the instance for a deployment associated with the applicable IAM user or AWS account.,https://raw.githubusercontent.com/aws/aws-sdk-js/master/apis/codedeploy-2014-10-06.normal.json
Amazon Web Services,codedeploy,RESOURCE,ListDeployments,POST,/listdeployments,Lists the deployments in a deployment group for an application registered with the applicable IAM user or AWS account.,https://raw.githubusercontent.com/aws/aws-sdk-js/master/apis/codedeploy-2014-10-06.normal.json
Amazon Web Services,codedeploy,RESOURCE,ListGitHubAccountTokenNames,POST,/listgithubaccounttokennames,Lists the names of stored connections to GitHub accounts.,https://raw.githubusercontent.com/aws/aws-sdk-js/master/apis/codedeploy-2014-10-06.normal.json
Amazon Web Services,codedeploy,RESOURCE,ListOnPremisesInstances,POST,/listonpremisesinstances,Gets a list of names for one or more on-premises instances. Unless otherwise specified, both registered and deregistered on-premises instance names will be listed. To list only registered or deregistered on-premises instance names, use the registration status parameter.,https://raw.githubusercontent.com/aws/aws-sdk-js/master/apis/codedeploy-2014-10-06.normal.json
Amazon Web Services,codedeploy,RESOURCE,RegisterApplicationRevision,POST,/registerapplicationrevision,Registers with AWS CodeDeploy a revision for the specified application.,https://raw.githubusercontent.com/aws/aws-sdk-js/master/apis/codedeploy-2014-10-06.normal.json
Amazon Web Services,codedeploy,RESOURCE,RegisterOnPremisesInstance,POST,/registeronpremisesinstance,Registers an on-premises instance.  Only one IAM ARN (an IAM session ARN or IAM user ARN) is supported in the request. You cannot use both. ,https://raw.githubusercontent.com/aws/aws-sdk-js/master/apis/codedeploy-2014-10-06.normal.json
Amazon Web Services,codedeploy,RESOURCE,RemoveTagsFromOnPremisesInstances,POST,/removetagsfromonpremisesinstances,Removes one or more tags from one or more on-premises instances.,https://raw.githubusercontent.com/aws/aws-sdk-js/master/apis/codedeploy-2014-10-06.normal.json
Amazon Web Services,codedeploy,RESOURCE,SkipWaitTimeForInstanceTermination,POST,/skipwaittimeforinstancetermination,In a blue/green deployment, overrides any specified wait time and starts terminating instances immediately after the traffic routing is completed.,https://raw.githubusercontent.com/aws/aws-sdk-js/master/apis/codedeploy-2014-10-06.normal.json
Amazon Web Services,codedeploy,RESOURCE,StopDeployment,POST,/stopdeployment,Attempts to stop an ongoing deployment.,https://raw.githubusercontent.com/aws/aws-sdk-js/master/apis/codedeploy-2014-10-06.normal.json
Amazon Web Services,codedeploy,RESOURCE,UpdateApplication,POST,/updateapplication,Changes the name of an application.,https://raw.githubusercontent.com/aws/aws-sdk-js/master/apis/codedeploy-2014-10-06.normal.json
Amazon Web Services,codedeploy,RESOURCE,UpdateDeploymentGroup,POST,/updatedeploymentgroup,Changes information about a deployment group.,https://raw.githubusercontent.com/aws/aws-sdk-js/master/apis/codedeploy-2014-10-06.normal.json
Amazon Web Services,codepipeline,RESOURCE,AcknowledgeJob,POST,/acknowledgejob,Returns information about a specified job and whether that job has been received by the job worker. Only used for custom actions.,https://raw.githubusercontent.com/aws/aws-sdk-js/master/apis/codepipeline-2015-07-09.normal.json
Amazon Web Services,codepipeline,RESOURCE,AcknowledgeThirdPartyJob,POST,/acknowledgethirdpartyjob,Confirms a job worker has received the specified job. Only used for partner actions.,https://raw.githubusercontent.com/aws/aws-sdk-js/master/apis/codepipeline-2015-07-09.normal.json
Amazon Web Services,codepipeline,RESOURCE,CreateCustomActionType,POST,/createcustomactiontype,Creates a new custom action that can be used in all pipelines associated with the AWS account. Only used for custom actions.,https://raw.githubusercontent.com/aws/aws-sdk-js/master/apis/codepipeline-2015-07-09.normal.json
Amazon Web Services,codepipeline,RESOURCE,CreatePipeline,POST,/createpipeline,Creates a pipeline.,https://raw.githubusercontent.com/aws/aws-sdk-js/master/apis/codepipeline-2015-07-09.normal.json
Amazon Web Services,codepipeline,RESOURCE,DeleteCustomActionType,POST,/deletecustomactiontype,Marks a custom action as deleted. PollForJobs for the custom action will fail after the action is marked for deletion. Only used for custom actions.  You cannot recreate a custom action after it has been deleted unless you increase the version number of the action. ,https://raw.githubusercontent.com/aws/aws-sdk-js/master/apis/codepipeline-2015-07-09.normal.json
Amazon Web Services,codepipeline,RESOURCE,DeletePipeline,POST,/deletepipeline,Deletes the specified pipeline.,https://raw.githubusercontent.com/aws/aws-sdk-js/master/apis/codepipeline-2015-07-09.normal.json
Amazon Web Services,codepipeline,RESOURCE,DisableStageTransition,POST,/disablestagetransition,Prevents artifacts in a pipeline from transitioning to the next stage in the pipeline.,https://raw.githubusercontent.com/aws/aws-sdk-js/master/apis/codepipeline-2015-07-09.normal.json
Amazon Web Services,codepipeline,RESOURCE,EnableStageTransition,POST,/enablestagetransition,Enables artifacts in a pipeline to transition to a stage in a pipeline.,https://raw.githubusercontent.com/aws/aws-sdk-js/master/apis/codepipeline-2015-07-09.normal.json
Amazon Web Services,codepipeline,RESOURCE,GetJobDetails,POST,/getjobdetails,Returns information about a job. Only used for custom actions.  When this API is called, AWS CodePipeline returns temporary credentials for the Amazon S3 bucket used to store artifacts for the pipeline, if the action requires access to that Amazon S3 bucket for input or output artifacts. Additionally, this API returns any secret values defined for the action. ,https://raw.githubusercontent.com/aws/aws-sdk-js/master/apis/codepipeline-2015-07-09.normal.json
Amazon Web Services,codepipeline,RESOURCE,GetPipeline,POST,/getpipeline,Returns the metadata, structure, stages, and actions of a pipeline. Can be used to return the entire structure of a pipeline in JSON format, which can then be modified and used to update the pipeline structure with UpdatePipeline.,https://raw.githubusercontent.com/aws/aws-sdk-js/master/apis/codepipeline-2015-07-09.normal.json
Amazon Web Services,codepipeline,RESOURCE,GetPipelineExecution,POST,/getpipelineexecution,Returns information about an execution of a pipeline, including details about artifacts, the pipeline execution ID, and the name, version, and status of the pipeline.,https://raw.githubusercontent.com/aws/aws-sdk-js/master/apis/codepipeline-2015-07-09.normal.json
Amazon Web Services,codepipeline,RESOURCE,GetPipelineState,POST,/getpipelinestate,Returns information about the state of a pipeline, including the stages and actions.,https://raw.githubusercontent.com/aws/aws-sdk-js/master/apis/codepipeline-2015-07-09.normal.json
Amazon Web Services,codepipeline,RESOURCE,GetThirdPartyJobDetails,POST,/getthirdpartyjobdetails,Requests the details of a job for a third party action. Only used for partner actions.  When this API is called, AWS CodePipeline returns temporary credentials for the Amazon S3 bucket used to store artifacts for the pipeline, if the action requires access to that Amazon S3 bucket for input or output artifacts. Additionally, this API returns any secret values defined for the action. ,https://raw.githubusercontent.com/aws/aws-sdk-js/master/apis/codepipeline-2015-07-09.normal.json
Amazon Web Services,codepipeline,RESOURCE,ListActionTypes,POST,/listactiontypes,Gets a summary of all AWS CodePipeline action types associated with your account.,https://raw.githubusercontent.com/aws/aws-sdk-js/master/apis/codepipeline-2015-07-09.normal.json
Amazon Web Services,codepipeline,RESOURCE,ListPipelineExecutions,POST,/listpipelineexecutions,Gets a summary of the most recent executions for a pipeline.,https://raw.githubusercontent.com/aws/aws-sdk-js/master/apis/codepipeline-2015-07-09.normal.json
Amazon Web Services,codepipeline,RESOURCE,ListPipelines,POST,/listpipelines,Gets a summary of all of the pipelines associated with your account.,https://raw.githubusercontent.com/aws/aws-sdk-js/master/apis/codepipeline-2015-07-09.normal.json
Amazon Web Services,codepipeline,RESOURCE,PollForJobs,POST,/pollforjobs,Returns information about any jobs for AWS CodePipeline to act upon.  When this API is called, AWS CodePipeline returns temporary credentials for the Amazon S3 bucket used to store artifacts for the pipeline, if the action requires access to that Amazon S3 bucket for input or output artifacts. Additionally, this API returns any secret values defined for the action. ,https://raw.githubusercontent.com/aws/aws-sdk-js/master/apis/codepipeline-2015-07-09.normal.json
Amazon Web Services,codepipeline,RESOURCE,PollForThirdPartyJobs,POST,/pollforthirdpartyjobs,Determines whether there are any third party jobs for a job worker to act on. Only used for partner actions.  When this API is called, AWS CodePipeline returns temporary credentials for the Amazon S3 bucket used to store artifacts for the pipeline, if the action requires access to that Amazon S3 bucket for input or output artifacts. ,https://raw.githubusercontent.com/aws/aws-sdk-js/master/apis/codepipeline-2015-07-09.normal.json
Amazon Web Services,codepipeline,RESOURCE,PutActionRevision,POST,/putactionrevision,Provides information to AWS CodePipeline about new revisions to a source.,https://raw.githubusercontent.com/aws/aws-sdk-js/master/apis/codepipeline-2015-07-09.normal.json
Amazon Web Services,codepipeline,RESOURCE,PutApprovalResult,POST,/putapprovalresult,Provides the response to a manual approval request to AWS CodePipeline. Valid responses include Approved and Rejected.,https://raw.githubusercontent.com/aws/aws-sdk-js/master/apis/codepipeline-2015-07-09.normal.json
Amazon Web Services,codepipeline,RESOURCE,PutJobFailureResult,POST,/putjobfailureresult,Represents the failure of a job as returned to the pipeline by a job worker. Only used for custom actions.,https://raw.githubusercontent.com/aws/aws-sdk-js/master/apis/codepipeline-2015-07-09.normal.json
Amazon Web Services,codepipeline,RESOURCE,PutJobSuccessResult,POST,/putjobsuccessresult,Represents the success of a job as returned to the pipeline by a job worker. Only used for custom actions.,https://raw.githubusercontent.com/aws/aws-sdk-js/master/apis/codepipeline-2015-07-09.normal.json
Amazon Web Services,codepipeline,RESOURCE,PutThirdPartyJobFailureResult,POST,/putthirdpartyjobfailureresult,Represents the failure of a third party job as returned to the pipeline by a job worker. Only used for partner actions.,https://raw.githubusercontent.com/aws/aws-sdk-js/master/apis/codepipeline-2015-07-09.normal.json
Amazon Web Services,codepipeline,RESOURCE,PutThirdPartyJobSuccessResult,POST,/putthirdpartyjobsuccessresult,Represents the success of a third party job as returned to the pipeline by a job worker. Only used for partner actions.,https://raw.githubusercontent.com/aws/aws-sdk-js/master/apis/codepipeline-2015-07-09.normal.json
Amazon Web Services,codepipeline,RESOURCE,RetryStageExecution,POST,/retrystageexecution,Resumes the pipeline execution by retrying the last failed actions in a stage.,https://raw.githubusercontent.com/aws/aws-sdk-js/master/apis/codepipeline-2015-07-09.normal.json
Amazon Web Services,codepipeline,RESOURCE,StartPipelineExecution,POST,/startpipelineexecution,Starts the specified pipeline. Specifically, it begins processing the latest commit to the source location specified as part of the pipeline.,https://raw.githubusercontent.com/aws/aws-sdk-js/master/apis/codepipeline-2015-07-09.normal.json
Amazon Web Services,codepipeline,RESOURCE,UpdatePipeline,POST,/updatepipeline,Updates a specified pipeline with edits or changes to its structure. Use a JSON file with the pipeline structure in conjunction with UpdatePipeline to provide the full structure of the pipeline. Updating the pipeline increases the version number of the pipeline by 1.,https://raw.githubusercontent.com/aws/aws-sdk-js/master/apis/codepipeline-2015-07-09.normal.json
Amazon Web Services,codestar,RESOURCE,AssociateTeamMember,POST,/associateteammember,Adds an IAM user to the team for an AWS CodeStar project.,https://raw.githubusercontent.com/aws/aws-sdk-js/master/apis/codestar-2017-04-19.normal.json
Amazon Web Services,codestar,RESOURCE,CreateProject,POST,/createproject,Reserved for future use. To create a project, use the AWS CodeStar console.,https://raw.githubusercontent.com/aws/aws-sdk-js/master/apis/codestar-2017-04-19.normal.json
Amazon Web Services,codestar,RESOURCE,CreateUserProfile,POST,/createuserprofile,Creates a profile for a user that includes user preferences, such as the display name and email address assocciated with the user, in AWS CodeStar. The user profile is not project-specific. Information in the user profile is displayed wherever the user's information appears to other users in AWS CodeStar.,https://raw.githubusercontent.com/aws/aws-sdk-js/master/apis/codestar-2017-04-19.normal.json
Amazon Web Services,codestar,RESOURCE,DeleteProject,POST,/deleteproject,Deletes a project, including project resources. Does not delete users associated with the project, but does delete the IAM roles that allowed access to the project.,https://raw.githubusercontent.com/aws/aws-sdk-js/master/apis/codestar-2017-04-19.normal.json
Amazon Web Services,codestar,RESOURCE,DeleteUserProfile,POST,/deleteuserprofile,Deletes a user profile in AWS CodeStar, including all personal preference data associated with that profile, such as display name and email address. It does not delete the history of that user, for example the history of commits made by that user.,https://raw.githubusercontent.com/aws/aws-sdk-js/master/apis/codestar-2017-04-19.normal.json
Amazon Web Services,codestar,RESOURCE,DescribeProject,POST,/describeproject,Describes a project and its resources.,https://raw.githubusercontent.com/aws/aws-sdk-js/master/apis/codestar-2017-04-19.normal.json
Amazon Web Services,codestar,RESOURCE,DescribeUserProfile,POST,/describeuserprofile,Describes a user in AWS CodeStar and the user attributes across all projects.,https://raw.githubusercontent.com/aws/aws-sdk-js/master/apis/codestar-2017-04-19.normal.json
Amazon Web Services,codestar,RESOURCE,DisassociateTeamMember,POST,/disassociateteammember,Removes a user from a project. Removing a user from a project also removes the IAM policies from that user that allowed access to the project and its resources. Disassociating a team member does not remove that user's profile from AWS CodeStar. It does not remove the user from IAM.,https://raw.githubusercontent.com/aws/aws-sdk-js/master/apis/codestar-2017-04-19.normal.json
Amazon Web Services,codestar,RESOURCE,ListProjects,POST,/listprojects,Lists all projects in AWS CodeStar associated with your AWS account.,https://raw.githubusercontent.com/aws/aws-sdk-js/master/apis/codestar-2017-04-19.normal.json
Amazon Web Services,codestar,RESOURCE,ListResources,POST,/listresources,Lists resources associated with a project in AWS CodeStar.,https://raw.githubusercontent.com/aws/aws-sdk-js/master/apis/codestar-2017-04-19.normal.json
Amazon Web Services,codestar,RESOURCE,ListTeamMembers,POST,/listteammembers,Lists all team members associated with a project.,https://raw.githubusercontent.com/aws/aws-sdk-js/master/apis/codestar-2017-04-19.normal.json
Amazon Web Services,codestar,RESOURCE,ListUserProfiles,POST,/listuserprofiles,Lists all the user profiles configured for your AWS account in AWS CodeStar.,https://raw.githubusercontent.com/aws/aws-sdk-js/master/apis/codestar-2017-04-19.normal.json
Amazon Web Services,codestar,RESOURCE,UpdateProject,POST,/updateproject,Updates a project in AWS CodeStar.,https://raw.githubusercontent.com/aws/aws-sdk-js/master/apis/codestar-2017-04-19.normal.json
Amazon Web Services,codestar,RESOURCE,UpdateTeamMember,POST,/updateteammember,Updates a team member's attributes in an AWS CodeStar project. For example, you can change a team member's role in the project, or change whether they have remote access to project resources.,https://raw.githubusercontent.com/aws/aws-sdk-js/master/apis/codestar-2017-04-19.normal.json
Amazon Web Services,codestar,RESOURCE,UpdateUserProfile,POST,/updateuserprofile,Updates a user's profile in AWS CodeStar. The user profile is not project-specific. Information in the user profile is displayed wherever the user's information appears to other users in AWS CodeStar. ,https://raw.githubusercontent.com/aws/aws-sdk-js/master/apis/codestar-2017-04-19.normal.json
Amazon Web Services,cognito-identity,RESOURCE,CreateIdentityPool,POST,/createidentitypool,Creates a new identity pool. The identity pool is a store of user identity information that is specific to your AWS account. The limit on identity pools is 60 per account. The keys for SupportedLoginProviders are as follows:   Facebook: graph.facebook.com    Google: accounts.google.com    Amazon: www.amazon.com    Twitter: api.twitter.com    Digits: www.digits.com    You must use AWS Developer credentials to call this API.,https://raw.githubusercontent.com/aws/aws-sdk-js/master/apis/cognito-identity-2014-06-30.normal.json
Amazon Web Services,cognito-identity,RESOURCE,DeleteIdentities,POST,/deleteidentities,Deletes identities from an identity pool. You can specify a list of 1-60 identities that you want to delete. You must use AWS Developer credentials to call this API.,https://raw.githubusercontent.com/aws/aws-sdk-js/master/apis/cognito-identity-2014-06-30.normal.json
Amazon Web Services,cognito-identity,RESOURCE,DeleteIdentityPool,POST,/deleteidentitypool,Deletes a user pool. Once a pool is deleted, users will not be able to authenticate with the pool. You must use AWS Developer credentials to call this API.,https://raw.githubusercontent.com/aws/aws-sdk-js/master/apis/cognito-identity-2014-06-30.normal.json
Amazon Web Services,cognito-identity,RESOURCE,DescribeIdentity,POST,/describeidentity,Returns metadata related to the given identity, including when the identity was created and any associated linked logins. You must use AWS Developer credentials to call this API.,https://raw.githubusercontent.com/aws/aws-sdk-js/master/apis/cognito-identity-2014-06-30.normal.json
Amazon Web Services,cognito-identity,RESOURCE,DescribeIdentityPool,POST,/describeidentitypool,Gets details about a particular identity pool, including the pool name, ID description, creation date, and current number of users. You must use AWS Developer credentials to call this API.,https://raw.githubusercontent.com/aws/aws-sdk-js/master/apis/cognito-identity-2014-06-30.normal.json
Amazon Web Services,cognito-identity,RESOURCE,GetCredentialsForIdentity,POST,/getcredentialsforidentity,Returns credentials for the provided identity ID. Any provided logins will be validated against supported login providers. If the token is for cognito-identity.amazonaws.com, it will be passed through to AWS Security Token Service with the appropriate role for the token. This is a public API. You do not need any credentials to call this API.,https://raw.githubusercontent.com/aws/aws-sdk-js/master/apis/cognito-identity-2014-06-30.normal.json
Amazon Web Services,cognito-identity,RESOURCE,GetId,POST,/getid,Generates (or retrieves) a Cognito ID. Supplying multiple logins will create an implicit linked account. This is a public API. You do not need any credentials to call this API.,https://raw.githubusercontent.com/aws/aws-sdk-js/master/apis/cognito-identity-2014-06-30.normal.json
Amazon Web Services,cognito-identity,RESOURCE,GetIdentityPoolRoles,POST,/getidentitypoolroles,Gets the roles for an identity pool. You must use AWS Developer credentials to call this API.,https://raw.githubusercontent.com/aws/aws-sdk-js/master/apis/cognito-identity-2014-06-30.normal.json
Amazon Web Services,cognito-identity,RESOURCE,GetOpenIdToken,POST,/getopenidtoken,Gets an OpenID token, using a known Cognito ID. This known Cognito ID is returned by GetId. You can optionally add additional logins for the identity. Supplying multiple logins creates an implicit link. The OpenId token is valid for 15 minutes. This is a public API. You do not need any credentials to call this API.,https://raw.githubusercontent.com/aws/aws-sdk-js/master/apis/cognito-identity-2014-06-30.normal.json
