Amazon Web Services,cloudhsm,RESOURCE,CreateHsm,POST,/createhsm,Creates an uninitialized HSM instance. There is an upfront fee charged for each HSM instance that you create with the CreateHsm operation. If you accidentally provision an HSM and want to request a refund, delete the instance using the DeleteHsm operation, go to the AWS Support Center, create a new case, and select Account and Billing Support.  It can take up to 20 minutes to create and provision an HSM. You can monitor the status of the HSM with the DescribeHsm operation. The HSM is ready to be initialized when the status changes to RUNNING. ,https://raw.githubusercontent.com/aws/aws-sdk-js/master/apis/cloudhsm-2014-05-30.normal.json
Amazon Web Services,cloudhsm,RESOURCE,CreateLunaClient,POST,/createlunaclient,Creates an HSM client.,https://raw.githubusercontent.com/aws/aws-sdk-js/master/apis/cloudhsm-2014-05-30.normal.json
Amazon Web Services,cloudhsm,RESOURCE,DeleteHapg,POST,/deletehapg,Deletes a high-availability partition group.,https://raw.githubusercontent.com/aws/aws-sdk-js/master/apis/cloudhsm-2014-05-30.normal.json
Amazon Web Services,cloudhsm,RESOURCE,DeleteHsm,POST,/deletehsm,Deletes an HSM. After completion, this operation cannot be undone and your key material cannot be recovered.,https://raw.githubusercontent.com/aws/aws-sdk-js/master/apis/cloudhsm-2014-05-30.normal.json
Amazon Web Services,cloudhsm,RESOURCE,DeleteLunaClient,POST,/deletelunaclient,Deletes a client.,https://raw.githubusercontent.com/aws/aws-sdk-js/master/apis/cloudhsm-2014-05-30.normal.json
Amazon Web Services,cloudhsm,RESOURCE,DescribeHapg,POST,/describehapg,Retrieves information about a high-availability partition group.,https://raw.githubusercontent.com/aws/aws-sdk-js/master/apis/cloudhsm-2014-05-30.normal.json
Amazon Web Services,cloudhsm,RESOURCE,DescribeHsm,POST,/describehsm,Retrieves information about an HSM. You can identify the HSM by its ARN or its serial number.,https://raw.githubusercontent.com/aws/aws-sdk-js/master/apis/cloudhsm-2014-05-30.normal.json
Amazon Web Services,cloudhsm,RESOURCE,DescribeLunaClient,POST,/describelunaclient,Retrieves information about an HSM client.,https://raw.githubusercontent.com/aws/aws-sdk-js/master/apis/cloudhsm-2014-05-30.normal.json
Amazon Web Services,cloudhsm,RESOURCE,GetConfig,POST,/getconfig,Gets the configuration files necessary to connect to all high availability partition groups the client is associated with.,https://raw.githubusercontent.com/aws/aws-sdk-js/master/apis/cloudhsm-2014-05-30.normal.json
Amazon Web Services,cloudhsm,RESOURCE,ListAvailableZones,POST,/listavailablezones,Lists the Availability Zones that have available AWS CloudHSM capacity.,https://raw.githubusercontent.com/aws/aws-sdk-js/master/apis/cloudhsm-2014-05-30.normal.json
Amazon Web Services,cloudhsm,RESOURCE,ListHapgs,POST,/listhapgs,Lists the high-availability partition groups for the account. This operation supports pagination with the use of the NextToken member. If more results are available, the NextToken member of the response contains a token that you pass in the next call to ListHapgs to retrieve the next set of items.,https://raw.githubusercontent.com/aws/aws-sdk-js/master/apis/cloudhsm-2014-05-30.normal.json
Amazon Web Services,cloudhsm,RESOURCE,ListHsms,POST,/listhsms,Retrieves the identifiers of all of the HSMs provisioned for the current customer. This operation supports pagination with the use of the NextToken member. If more results are available, the NextToken member of the response contains a token that you pass in the next call to ListHsms to retrieve the next set of items.,https://raw.githubusercontent.com/aws/aws-sdk-js/master/apis/cloudhsm-2014-05-30.normal.json
Amazon Web Services,cloudhsm,RESOURCE,ListLunaClients,POST,/listlunaclients,Lists all of the clients. This operation supports pagination with the use of the NextToken member. If more results are available, the NextToken member of the response contains a token that you pass in the next call to ListLunaClients to retrieve the next set of items.,https://raw.githubusercontent.com/aws/aws-sdk-js/master/apis/cloudhsm-2014-05-30.normal.json
Amazon Web Services,cloudhsm,RESOURCE,ListTagsForResource,POST,/listtagsforresource,Returns a list of all tags for the specified AWS CloudHSM resource.,https://raw.githubusercontent.com/aws/aws-sdk-js/master/apis/cloudhsm-2014-05-30.normal.json
Amazon Web Services,cloudhsm,RESOURCE,ModifyHapg,POST,/modifyhapg,Modifies an existing high-availability partition group.,https://raw.githubusercontent.com/aws/aws-sdk-js/master/apis/cloudhsm-2014-05-30.normal.json
Amazon Web Services,cloudhsm,RESOURCE,ModifyHsm,POST,/modifyhsm,Modifies an HSM.  This operation can result in the HSM being offline for up to 15 minutes while the AWS CloudHSM service is reconfigured. If you are modifying a production HSM, you should ensure that your AWS CloudHSM service is configured for high availability, and consider executing this operation during a maintenance window. ,https://raw.githubusercontent.com/aws/aws-sdk-js/master/apis/cloudhsm-2014-05-30.normal.json
Amazon Web Services,cloudhsm,RESOURCE,ModifyLunaClient,POST,/modifylunaclient,Modifies the certificate used by the client. This action can potentially start a workflow to install the new certificate on the client's HSMs.,https://raw.githubusercontent.com/aws/aws-sdk-js/master/apis/cloudhsm-2014-05-30.normal.json
Amazon Web Services,cloudhsm,RESOURCE,RemoveTagsFromResource,POST,/removetagsfromresource,Removes one or more tags from the specified AWS CloudHSM resource. To remove a tag, specify only the tag key to remove (not the value). To overwrite the value for an existing tag, use AddTagsToResource.,https://raw.githubusercontent.com/aws/aws-sdk-js/master/apis/cloudhsm-2014-05-30.normal.json
Amazon Web Services,cloudhsmv2,RESOURCE,CreateCluster,POST,/createcluster,Creates a new AWS CloudHSM cluster.,https://raw.githubusercontent.com/aws/aws-sdk-js/master/apis/cloudhsmv2-2017-04-28.normal.json
Amazon Web Services,cloudhsmv2,RESOURCE,CreateHsm,POST,/createhsm,Creates a new hardware security module (HSM) in the specified AWS CloudHSM cluster.,https://raw.githubusercontent.com/aws/aws-sdk-js/master/apis/cloudhsmv2-2017-04-28.normal.json
Amazon Web Services,cloudhsmv2,RESOURCE,DeleteCluster,POST,/deletecluster,Deletes the specified AWS CloudHSM cluster. Before you can delete a cluster, you must delete all HSMs in the cluster. To see if the cluster contains any HSMs, use DescribeClusters. To delete an HSM, use DeleteHsm.,https://raw.githubusercontent.com/aws/aws-sdk-js/master/apis/cloudhsmv2-2017-04-28.normal.json
Amazon Web Services,cloudhsmv2,RESOURCE,DeleteHsm,POST,/deletehsm,Deletes the specified HSM. To specify an HSM, you can use its identifier (ID), the IP address of the HSM's elastic network interface (ENI), or the ID of the HSM's ENI. You need to specify only one of these values. To find these values, use DescribeClusters.,https://raw.githubusercontent.com/aws/aws-sdk-js/master/apis/cloudhsmv2-2017-04-28.normal.json
Amazon Web Services,cloudhsmv2,RESOURCE,DescribeBackups,POST,/describebackups,Gets information about backups of AWS CloudHSM clusters. This is a paginated operation, which means that each response might contain only a subset of all the backups. When the response contains only a subset of backups, it includes a NextToken value. Use this value in a subsequent DescribeBackups request to get more backups. When you receive a response with no NextToken (or an empty or null value), that means there are no more backups to get.,https://raw.githubusercontent.com/aws/aws-sdk-js/master/apis/cloudhsmv2-2017-04-28.normal.json
Amazon Web Services,cloudhsmv2,RESOURCE,DescribeClusters,POST,/describeclusters,Gets information about AWS CloudHSM clusters. This is a paginated operation, which means that each response might contain only a subset of all the clusters. When the response contains only a subset of clusters, it includes a NextToken value. Use this value in a subsequent DescribeClusters request to get more clusters. When you receive a response with no NextToken (or an empty or null value), that means there are no more clusters to get.,https://raw.githubusercontent.com/aws/aws-sdk-js/master/apis/cloudhsmv2-2017-04-28.normal.json
Amazon Web Services,cloudhsmv2,RESOURCE,InitializeCluster,POST,/initializecluster,Claims an AWS CloudHSM cluster by submitting the cluster certificate issued by your issuing certificate authority (CA) and the CA's root certificate. Before you can claim a cluster, you must sign the cluster's certificate signing request (CSR) with your issuing CA. To get the cluster's CSR, use DescribeClusters.,https://raw.githubusercontent.com/aws/aws-sdk-js/master/apis/cloudhsmv2-2017-04-28.normal.json
Amazon Web Services,cloudhsmv2,RESOURCE,ListTags,POST,/listtags,Gets a list of tags for the specified AWS CloudHSM cluster. This is a paginated operation, which means that each response might contain only a subset of all the tags. When the response contains only a subset of tags, it includes a NextToken value. Use this value in a subsequent ListTags request to get more tags. When you receive a response with no NextToken (or an empty or null value), that means there are no more tags to get.,https://raw.githubusercontent.com/aws/aws-sdk-js/master/apis/cloudhsmv2-2017-04-28.normal.json
Amazon Web Services,cloudhsmv2,RESOURCE,TagResource,POST,/tagresource,Adds or overwrites one or more tags for the specified AWS CloudHSM cluster.,https://raw.githubusercontent.com/aws/aws-sdk-js/master/apis/cloudhsmv2-2017-04-28.normal.json
Amazon Web Services,cloudhsmv2,RESOURCE,UntagResource,POST,/untagresource,Removes the specified tag or tags from the specified AWS CloudHSM cluster.,https://raw.githubusercontent.com/aws/aws-sdk-js/master/apis/cloudhsmv2-2017-04-28.normal.json
Amazon Web Services,cloudsearch,RESOURCE,CreateDomain,POST,/createdomain,Creates a new search domain.,https://raw.githubusercontent.com/aws/aws-sdk-js/master/apis/cloudsearch-2011-02-01.normal.json
Amazon Web Services,cloudsearch,RESOURCE,DefineIndexField,POST,/defineindexfield,Configures an IndexField for the search domain. Used to create new fields and modify existing ones. If the field exists, the new configuration replaces the old one. You can configure a maximum of 200 index fields.,https://raw.githubusercontent.com/aws/aws-sdk-js/master/apis/cloudsearch-2011-02-01.normal.json
Amazon Web Services,cloudsearch,RESOURCE,DefineRankExpression,POST,/definerankexpression,Configures a RankExpression for the search domain. Used to create new rank expressions and modify existing ones. If the expression exists, the new configuration replaces the old one. You can configure a maximum of 50 rank expressions.,https://raw.githubusercontent.com/aws/aws-sdk-js/master/apis/cloudsearch-2011-02-01.normal.json
Amazon Web Services,cloudsearch,RESOURCE,DeleteDomain,POST,/deletedomain,Permanently deletes a search domain and all of its data.,https://raw.githubusercontent.com/aws/aws-sdk-js/master/apis/cloudsearch-2011-02-01.normal.json
Amazon Web Services,cloudsearch,RESOURCE,DeleteIndexField,POST,/deleteindexfield,Removes an IndexField from the search domain.,https://raw.githubusercontent.com/aws/aws-sdk-js/master/apis/cloudsearch-2011-02-01.normal.json
Amazon Web Services,cloudsearch,RESOURCE,DeleteRankExpression,POST,/deleterankexpression,Removes a RankExpression from the search domain.,https://raw.githubusercontent.com/aws/aws-sdk-js/master/apis/cloudsearch-2011-02-01.normal.json
Amazon Web Services,cloudsearch,RESOURCE,DescribeAvailabilityOptions,POST,/describeavailabilityoptions,Gets the availability options configured for a domain. By default, shows the configuration with any pending changes. Set the Deployed option to true to show the active configuration and exclude pending changes. For more information, see Configuring Availability Options in the Amazon CloudSearch Developer Guide.,https://raw.githubusercontent.com/aws/aws-sdk-js/master/apis/cloudsearch-2011-02-01.normal.json
Amazon Web Services,cloudsearch,RESOURCE,DescribeDefaultSearchField,POST,/describedefaultsearchfield,Gets the default search field configured for the search domain.,https://raw.githubusercontent.com/aws/aws-sdk-js/master/apis/cloudsearch-2011-02-01.normal.json
Amazon Web Services,cloudsearch,RESOURCE,DescribeDomains,POST,/describedomains,Gets information about the search domains owned by this account. Can be limited to specific domains. Shows all domains by default.,https://raw.githubusercontent.com/aws/aws-sdk-js/master/apis/cloudsearch-2011-02-01.normal.json
Amazon Web Services,cloudsearch,RESOURCE,DescribeIndexFields,POST,/describeindexfields,Gets information about the index fields configured for the search domain. Can be limited to specific fields by name. Shows all fields by default.,https://raw.githubusercontent.com/aws/aws-sdk-js/master/apis/cloudsearch-2011-02-01.normal.json
Amazon Web Services,cloudsearch,RESOURCE,DescribeRankExpressions,POST,/describerankexpressions,Gets the rank expressions configured for the search domain. Can be limited to specific rank expressions by name. Shows all rank expressions by default. ,https://raw.githubusercontent.com/aws/aws-sdk-js/master/apis/cloudsearch-2011-02-01.normal.json
Amazon Web Services,cloudsearch,RESOURCE,DescribeServiceAccessPolicies,POST,/describeserviceaccesspolicies,Gets information about the resource-based policies that control access to the domain's document and search services.,https://raw.githubusercontent.com/aws/aws-sdk-js/master/apis/cloudsearch-2011-02-01.normal.json
Amazon Web Services,cloudsearch,RESOURCE,DescribeStemmingOptions,POST,/describestemmingoptions,Gets the stemming dictionary configured for the search domain.,https://raw.githubusercontent.com/aws/aws-sdk-js/master/apis/cloudsearch-2011-02-01.normal.json
Amazon Web Services,cloudsearch,RESOURCE,DescribeStopwordOptions,POST,/describestopwordoptions,Gets the stopwords configured for the search domain.,https://raw.githubusercontent.com/aws/aws-sdk-js/master/apis/cloudsearch-2011-02-01.normal.json
Amazon Web Services,cloudsearch,RESOURCE,DescribeSynonymOptions,POST,/describesynonymoptions,Gets the synonym dictionary configured for the search domain.,https://raw.githubusercontent.com/aws/aws-sdk-js/master/apis/cloudsearch-2011-02-01.normal.json
Amazon Web Services,cloudsearch,RESOURCE,IndexDocuments,POST,/indexdocuments,Tells the search domain to start indexing its documents using the latest text processing options and IndexFields. This operation must be invoked to make options whose OptionStatus has OptionState of RequiresIndexDocuments visible in search results.,https://raw.githubusercontent.com/aws/aws-sdk-js/master/apis/cloudsearch-2011-02-01.normal.json
Amazon Web Services,cloudsearch,RESOURCE,UpdateAvailabilityOptions,POST,/updateavailabilityoptions,Configures the availability options for a domain. Enabling the Multi-AZ option expands an Amazon CloudSearch domain to an additional Availability Zone in the same Region to increase fault tolerance in the event of a service disruption. Changes to the Multi-AZ option can take about half an hour to become active. For more information, see Configuring Availability Options in the Amazon CloudSearch Developer Guide.,https://raw.githubusercontent.com/aws/aws-sdk-js/master/apis/cloudsearch-2011-02-01.normal.json
Amazon Web Services,cloudsearch,RESOURCE,UpdateDefaultSearchField,POST,/updatedefaultsearchfield,Configures the default search field for the search domain. The default search field is the text field that is searched when a search request does not specify which fields to search. By default, it is configured to include the contents of all of the domain's text fields. ,https://raw.githubusercontent.com/aws/aws-sdk-js/master/apis/cloudsearch-2011-02-01.normal.json
Amazon Web Services,cloudsearch,RESOURCE,UpdateServiceAccessPolicies,POST,/updateserviceaccesspolicies,Configures the policies that control access to the domain's document and search services. The maximum size of an access policy document is 100 KB.,https://raw.githubusercontent.com/aws/aws-sdk-js/master/apis/cloudsearch-2011-02-01.normal.json
Amazon Web Services,cloudsearch,RESOURCE,UpdateStemmingOptions,POST,/updatestemmingoptions,Configures a stemming dictionary for the search domain. The stemming dictionary is used during indexing and when processing search requests. The maximum size of the stemming dictionary is 500 KB.,https://raw.githubusercontent.com/aws/aws-sdk-js/master/apis/cloudsearch-2011-02-01.normal.json
Amazon Web Services,cloudsearch,RESOURCE,UpdateStopwordOptions,POST,/updatestopwordoptions,Configures stopwords for the search domain. Stopwords are used during indexing and when processing search requests. The maximum size of the stopwords dictionary is 10 KB.,https://raw.githubusercontent.com/aws/aws-sdk-js/master/apis/cloudsearch-2011-02-01.normal.json
Amazon Web Services,cloudsearch,RESOURCE,UpdateSynonymOptions,POST,/updatesynonymoptions,Configures a synonym dictionary for the search domain. The synonym dictionary is used during indexing to configure mappings for terms that occur in text fields. The maximum size of the synonym dictionary is 100 KB. ,https://raw.githubusercontent.com/aws/aws-sdk-js/master/apis/cloudsearch-2011-02-01.normal.json
Amazon Web Services,cloudsearch,RESOURCE,BuildSuggesters,POST,/buildsuggesters,Indexes the search suggestions. For more information, see Configuring Suggesters in the Amazon CloudSearch Developer Guide.,https://raw.githubusercontent.com/aws/aws-sdk-js/master/apis/cloudsearch-2013-01-01.normal.json
Amazon Web Services,cloudsearch,RESOURCE,CreateDomain,POST,/createdomain,Creates a new search domain. For more information, see Creating a Search Domain in the Amazon CloudSearch Developer Guide.,https://raw.githubusercontent.com/aws/aws-sdk-js/master/apis/cloudsearch-2013-01-01.normal.json
Amazon Web Services,cloudsearch,RESOURCE,DefineAnalysisScheme,POST,/defineanalysisscheme,Configures an analysis scheme that can be applied to a text or text-array field to define language-specific text processing options. For more information, see Configuring Analysis Schemes in the Amazon CloudSearch Developer Guide.,https://raw.githubusercontent.com/aws/aws-sdk-js/master/apis/cloudsearch-2013-01-01.normal.json
Amazon Web Services,cloudsearch,RESOURCE,DefineExpression,POST,/defineexpression,Configures an Expression for the search domain. Used to create new expressions and modify existing ones. If the expression exists, the new configuration replaces the old one. For more information, see Configuring Expressions in the Amazon CloudSearch Developer Guide.,https://raw.githubusercontent.com/aws/aws-sdk-js/master/apis/cloudsearch-2013-01-01.normal.json
Amazon Web Services,cloudsearch,RESOURCE,DefineIndexField,POST,/defineindexfield,Configures an IndexField for the search domain. Used to create new fields and modify existing ones. You must specify the name of the domain you are configuring and an index field configuration. The index field configuration specifies a unique name, the index field type, and the options you want to configure for the field. The options you can specify depend on the IndexFieldType. If the field exists, the new configuration replaces the old one. For more information, see Configuring Index Fields in the Amazon CloudSearch Developer Guide. ,https://raw.githubusercontent.com/aws/aws-sdk-js/master/apis/cloudsearch-2013-01-01.normal.json
Amazon Web Services,cloudsearch,RESOURCE,DefineSuggester,POST,/definesuggester,Configures a suggester for a domain. A suggester enables you to display possible matches before users finish typing their queries. When you configure a suggester, you must specify the name of the text field you want to search for possible matches and a unique name for the suggester. For more information, see Getting Search Suggestions in the Amazon CloudSearch Developer Guide.,https://raw.githubusercontent.com/aws/aws-sdk-js/master/apis/cloudsearch-2013-01-01.normal.json
Amazon Web Services,cloudsearch,RESOURCE,DeleteAnalysisScheme,POST,/deleteanalysisscheme,Deletes an analysis scheme. For more information, see Configuring Analysis Schemes in the Amazon CloudSearch Developer Guide. ,https://raw.githubusercontent.com/aws/aws-sdk-js/master/apis/cloudsearch-2013-01-01.normal.json
Amazon Web Services,cloudsearch,RESOURCE,DeleteDomain,POST,/deletedomain,Permanently deletes a search domain and all of its data. Once a domain has been deleted, it cannot be recovered. For more information, see Deleting a Search Domain in the Amazon CloudSearch Developer Guide. ,https://raw.githubusercontent.com/aws/aws-sdk-js/master/apis/cloudsearch-2013-01-01.normal.json
Amazon Web Services,cloudsearch,RESOURCE,DeleteExpression,POST,/deleteexpression,Removes an Expression from the search domain. For more information, see Configuring Expressions in the Amazon CloudSearch Developer Guide.,https://raw.githubusercontent.com/aws/aws-sdk-js/master/apis/cloudsearch-2013-01-01.normal.json
Amazon Web Services,cloudsearch,RESOURCE,DeleteIndexField,POST,/deleteindexfield,Removes an IndexField from the search domain. For more information, see Configuring Index Fields in the Amazon CloudSearch Developer Guide.,https://raw.githubusercontent.com/aws/aws-sdk-js/master/apis/cloudsearch-2013-01-01.normal.json
Amazon Web Services,cloudsearch,RESOURCE,DeleteSuggester,POST,/deletesuggester,Deletes a suggester. For more information, see Getting Search Suggestions in the Amazon CloudSearch Developer Guide.,https://raw.githubusercontent.com/aws/aws-sdk-js/master/apis/cloudsearch-2013-01-01.normal.json
Amazon Web Services,cloudsearch,RESOURCE,DescribeAnalysisSchemes,POST,/describeanalysisschemes,Gets the analysis schemes configured for a domain. An analysis scheme defines language-specific text processing options for a text field. Can be limited to specific analysis schemes by name. By default, shows all analysis schemes and includes any pending changes to the configuration. Set the Deployed option to true to show the active configuration and exclude pending changes. For more information, see Configuring Analysis Schemes in the Amazon CloudSearch Developer Guide.,https://raw.githubusercontent.com/aws/aws-sdk-js/master/apis/cloudsearch-2013-01-01.normal.json
Amazon Web Services,cloudsearch,RESOURCE,DescribeAvailabilityOptions,POST,/describeavailabilityoptions,Gets the availability options configured for a domain. By default, shows the configuration with any pending changes. Set the Deployed option to true to show the active configuration and exclude pending changes. For more information, see Configuring Availability Options in the Amazon CloudSearch Developer Guide.,https://raw.githubusercontent.com/aws/aws-sdk-js/master/apis/cloudsearch-2013-01-01.normal.json
Amazon Web Services,cloudsearch,RESOURCE,DescribeDomains,POST,/describedomains,Gets information about the search domains owned by this account. Can be limited to specific domains. Shows all domains by default. To get the number of searchable documents in a domain, use the console or submit a matchall request to your domain's search endpoint: q=matchall&amp;amp;q.parser=structured&amp;amp;size=0. For more information, see Getting Information about a Search Domain in the Amazon CloudSearch Developer Guide.,https://raw.githubusercontent.com/aws/aws-sdk-js/master/apis/cloudsearch-2013-01-01.normal.json
Amazon Web Services,cloudsearch,RESOURCE,DescribeExpressions,POST,/describeexpressions,Gets the expressions configured for the search domain. Can be limited to specific expressions by name. By default, shows all expressions and includes any pending changes to the configuration. Set the Deployed option to true to show the active configuration and exclude pending changes. For more information, see Configuring Expressions in the Amazon CloudSearch Developer Guide.,https://raw.githubusercontent.com/aws/aws-sdk-js/master/apis/cloudsearch-2013-01-01.normal.json
Amazon Web Services,cloudsearch,RESOURCE,DescribeIndexFields,POST,/describeindexfields,Gets information about the index fields configured for the search domain. Can be limited to specific fields by name. By default, shows all fields and includes any pending changes to the configuration. Set the Deployed option to true to show the active configuration and exclude pending changes. For more information, see Getting Domain Information in the Amazon CloudSearch Developer Guide.,https://raw.githubusercontent.com/aws/aws-sdk-js/master/apis/cloudsearch-2013-01-01.normal.json
Amazon Web Services,cloudsearch,RESOURCE,DescribeScalingParameters,POST,/describescalingparameters,Gets the scaling parameters configured for a domain. A domain's scaling parameters specify the desired search instance type and replication count. For more information, see Configuring Scaling Options in the Amazon CloudSearch Developer Guide.,https://raw.githubusercontent.com/aws/aws-sdk-js/master/apis/cloudsearch-2013-01-01.normal.json
Amazon Web Services,cloudsearch,RESOURCE,DescribeServiceAccessPolicies,POST,/describeserviceaccesspolicies,Gets information about the access policies that control access to the domain's document and search endpoints. By default, shows the configuration with any pending changes. Set the Deployed option to true to show the active configuration and exclude pending changes. For more information, see Configuring Access for a Search Domain in the Amazon CloudSearch Developer Guide.,https://raw.githubusercontent.com/aws/aws-sdk-js/master/apis/cloudsearch-2013-01-01.normal.json
